7,크리스가 2층으로 올라갈때 떠들썩하던 1층사람들 갑자기 조용해질때 소름 이장면이 제일 무서웠음
9,광명롯시] 확실히 독특했다. 짙은 스릴러로 인한 타이트한 긴장감이 좋았다. 스토리와 음악도 훌륭했다. 딱히 흠잡을 데 없이 재밌었지만 내가 영화에서 기대하는 뭔가 스펙타클한 장면이나 무의식에만 존재할거 같은 밑바닥의...
5,신하균 주연의 더게임을 봤다면 큰 충격(?)이 없음...인종차별을 소재로만 활용할 뿐 메시지는 없음. 걍 그랬음...그나저나 솜이 그렇게 방음이 잘되나?
8,진짜  여태껏 본 공포영화 중에 제일 깔끔했음. 밤에 생각날 것 같지도 않고 그냥 영화관에서 완전 재밌게 보고 개운하게 나올 수 있음.
10,처음보고 한장면한장면 다시 생각나서  두번째로 봤는데 처음봤을때랑  완전 다른 영화가 돼버리네... 몇번을 다시 볼때마다 계속 보고싶어지는 영화
10,재밌음. 가서 보셈. 후회 안함.
10,"백인 우월주의, 아직도 흑인에 대한 인종차별이 심하다는 현실을 보여주네"
10,여기서 평점보면서 장면하나하나와 엔딩 하나하나를 곱씹어보니 .... 너무 소름돋고 정말 좋은영화 bb
10,경찰차가 왔을때 긴장한 이유는?
10,크리스가 박스에서 사진 발견했을때 마지막에 조지아 사진 나오고 나서 ㄹㅇ 소름 돋음
10,뻔한 내용을 전혀 색다르게 만들어버렸다.
9,난 참 아쉽다고 생각하는게 다들 내용이 뻔하다고 예측가능하다면서 허세가득한 글로 깎아내리는데... 내용에 집착하니까 감독이 숨겨놓은 메세지를 전혀 이해하려 하지 않음.
8,커피젓는 아줌마 한대치고 싶더라
10,갑툭튀 없는 공포 영화 중 다섯손가락 안에 드는 영화였다. 해석이 제각각이라는데 왜 해석이 여러개인지 모르겠음.
9,와 갑자기 내여친이 무서워졌다
8,트럼프가 보면 안될영화 ㅋㅋ
9,깔끔하니 진행도 좋고 깔린 복선들도 아주 어렵지 않아서 더 좋았는데?
9,내용 대충 알고 봤지만 그래도 충격이네요.. 남자 주인공 여자친구 진짜 턱 갈겨주고싶었는데
10,존잼인데옹보는내내심장쫄깃
10,와 진짜 미쳤어요 ㅋㅋㅋ 간만에 쫄깃한 영화봤네요 후하
10,"최고의영화, 연기력 단연 최고"
8,굉장히 신선해요. 내가 주인공이 된것처럼 몰입하고 하나하나 해석하게 됩니다. 주인공표정=내표정 ㅋㅋ코난된것처럼 영화를 즐겼네요 감사합니다~
7,몇몇 사람들이 말하듯이 반전 영화라고 생각하면 안됨 그러기엔 너무 정직한 내용 다만 하나하나 의미들을 찾는 재미가 쏠쏠
5,보지마세요노잼이에요
10,여주 연기도 좋았음 굿드
9,마지막이 아쉽지만  재밌습니다.
9,여자분 연기잘하네요 ㅋ
10,이제까지 인종차별을 다룬 영화가 '모든 인종은 같은 사람이다'라는 말을 헸던걸 생각하면 이 영화가 품고 있는 메시지가 얼마나 충격적인지 새삼 놀랍다. 스릴러로써도 충분히 재미있음
7,너무 과한 홍보가 독이된 영화. 너무 기대를 하고 봤지만... 줄거리는 광고에서 보여주는 게 전부인 영화. 하지만 나름 긴장감있고 볼만은 했기때문에 7점!
9,간만에 영화다운 영화 봤다. 물론 예고편은 보지말길 전부 스포덩어리
9,"몰입감 쩔고 영화 구성이 굉장히 치밀함. 나중에 알고보니 대충 지나갔던 장면이나 소품, 연기가 하나도 없었음. 시사하는 바도 나름 컸고 무엇보다 복산을 되돌아가면 모든 장면들이 다 나중에 결말을 위한 하나하나의 조각..."
9,"★보실분들은, 예고편은 절대 보지말고 보시길!!        ★평점이 호불호가 많이 갈린대서 걱정하며 봤는데, 저하고 친구는 완전 재밌게 봤어요ㅋㅋㅋ  다만, 예고편 보고 보신분들은 이미 스포가 다된 내용이라 실망하..."
10,미친듯이재밌음...
10,진짜 개존잼 !!! 큰 기대안하고 봐서 그런가여튼 올해 본 영화중 최곸ㅋㅋ
8,스켈레톤의 키가 좀더 원초적이고 잘만들었다.
3,공포도 스릴도 설득력도 모두 겟 아웃~~!!!
6,너무기대를 많이한듯요
10,솜뭉치 성능이 ㄷㄷ 막아도 다 들릴 것 만같은데....
8,"재밋었지만, 로튼 토마토 신선도99퍼센트 정도까지는 아닌듯?"
10,"살면서 단 한번도 느껴보지 못한 무서움의 종류였다. 음향, 연출, 영상 가리지 않고 대단. 영화관에서 한번 더 보고싶은 영화."
10,진심 뭐지 진짜 이건 한번 더봐야 영화 봤다고 할 수 있을듯 진심 예고편이고 뭐고 그냥 가서 보는게 최고인듯요 진심 진짜ㅜㅜ
2,허무하고 뻔하고 지루한 영화ㅠ 오 이제 좀 스릴있어지나??  하는데 끝난다. 보는 내내 스켈리톤 킬 영화가 생각낫는데 큰 틀의 스토리는 매우 비슷~  스켈리톤 킬이  훨씬 재밌게 본 기억이 있다.
2,보면서 정신병 걸리는줄 알았는데;;;;
8,곱씹는 재미가 영화..근데 오히려 결말은 느슨하게 마무리하는거같아 아쉬움
9,귀신안나오면서 무서운 영화가 진짜 무서운 영화지
6,흥행에 성공한 B급 영화
9,흑인 차별이 아니라 흑사모(흑인을 사랑하는 사람들의 모임)
9,신속히 전개되으는 마무리가 아쉽다
9,간만에 진짜 재밋게 스릴러봣네요
9,푹 빠졌다영화 끝난 후의 앞뒤 관련 내용을 떠올려보면 놀라움
10,이런 류의 영화를 너무 좋아하는데 곡성보다는 덜하지만 그래도 sink! 할때 나도 가라앉는 느낌 딱히 나에게 반전이랄건 없었지만 소름돋는 장면들은 많았다 이런영화가 많이 나왓으면
10,"와 진짜 오랜만에 제대로 된 영화 본거같다 행동 , 했던 말 하나하나 다 소름돋는다"
8,톱니바퀴처럼 잘 짜여진 영화. 극중 장면장면을 곱씹다 보면 인종차별에 대한 신랄한 고발을 느낄 수 있다.
10,올해 본 최고의 영회! 최고!
10,여태까지 봤던 영화들이 수두룩한데도 이 영화는 태어나서 처음보는 내용이고 너무 신선했다!!
10,주인공이 시원시원하게 다 날려버릴때 맘에 들었다
9,이런 병맛나는 영화는 정말 오랜만이다(좋은 의미로다가) 아무것도 모르고 봤는데 에이리언보다 더무서움 ㅋㅋ
10,"미스테리함, 지속적인 긴장감, 사회적 이슈, 코믹한 요소의 가미, 반전까지 여러가지 복합적인 부분을 상당히 성공적으로 연출했다. 아쉬운 부분도 다소 있지만, 동종 장르에서 이색적인 매력을 가졌다는 것만으로도 충분히 ..."
7,여자년은 OOO 소리가 절로 나오더라구요ㅎㅎOO!!! 인종차별을 굉장히 극화해서 표현했네요..흑인을 장기를 대체하는 짐승?처럼 설정한게 넘 잔인해요. 현실에서 차별당하는 이들의 마음도그렇겠죠? 주인공 친구의 명대사도...
10,너무 새롭다. 최고최고 영화 끝나고 나오는 길에 그 짜릿함에 발을 얼마나 바닥에 쳤는지. 곡성 봤을때의 기분
10,"진짜 반전과 , 심리적으로 스릴 넘치고 그냥 말다 필요없고 꼭 보세요. 너무 재미있고 신선한 내용이에요"
10,보는 내내 소름끼치고 긴장됐다.... 내가 다 두근거리고 손에 땀이... 커피 젓는 사각 사각 소리는 아직도 싫음...
10,와 ... 진짜 무서워 ... 크리스는 진짜 대단하다안무서웟을까 ㅠㅠㅠㅠ 다 처리하고 경찰차 왓을때 너무 다행이엇어 ㅠㅜㅜㅜ로즈는 목졸랏지만 죽이진 못햇지 ? 착한 크리스 ㅜ암튼 진짜 재밋다. 꼭봐요 다들
10,진짜 재밌어요 ! 강추합니다
10,기대안하고 봣는데 레알 역대급 영화다. 온몸이 마비되는 듯한 긴장감이 영화보는 내내 느껴졌다 무슨 인종 풍자같은 것도 담고 있는 것 같은데 그런거 파악하는 재미도 있었고 이건 감독이 천재다 더 쓰고싶은데 글자수가 정...
10,와우... 우연찮게 봤는데 대박이네
10,최고 다른말 필요 없음!!!~~~
10,이런게 영화지 OO 나오면서 같이 본 사람이랑 얘기도 좀 할 수 있는 영화 요새 한국 영화는 보고 나오며너 할 얘기가 없다
10,오랜만에 보는 핵사이다 영화!! 사이다장면이짧아서 조금아쉬움ㅜ
10,곡성이랑 엮어서 귀신나오는건줄 알았네왜 곡성이랑 엮냐 완전 다른느낌이고이거완전 수작 아니냐물논 빼어날 수. 곡성도 물론 좋은작품
10,신선했다. 그런데 영화가 끝나고 오는 이 찝찝한 기분은 떨칠수가 없네
10,최고의영화!탄탄한스토리
10,재밌쥬 잘 만든 것 같아융
10,무서운거 못보는 편이라 쫄면서 봤는데 그래도 진짜 신박한 내용에 평화롭게 끝나서 만족스러웠어요 미국판 곡성이라는데 곡성 안봐서 잘 모르겠지만 현실적이라서 찝찝하거나 하진 않아요 꼭 보세요!!
10,몰입도 최고 추천합니다
8,오늘봣는데 뒤에 앉은 사람놀라면서 욕하는것도 웃겻음..아쉬운건 예고편 장면에 라이트키면 사슴뼈 나오는장면이있는데 영화에 안나왔는데 나만 그장면못봤자나?화장실난가고 계속 몰입하면서 봣는데 안나옴..
10,요즘 들어 보기드문 수작!!
10,그냥 이 영화는 예고편을 만들지 않고 개봉했어야했다 그냥 예고편 공개 자체가 스포였는데??
10,예고편 보고 보지 마세요 안보고 봤으면 더 재밌게 봤을거 같네요
10,재밌어요 정말  미스터리한  신기한소재의 영화
10,100점주고싶다 예고편안보고기대안하고 갔는데 진짜 너무충격과재미가있었다. 예고편 ㄴㄴ
9,몰입감 장난아니네 최면이 이렇게 무섭다니
10,다 믿어서는 안된다~ 진심 꿀잼 믿고 보세요
8,재밌었어요!!ㅋㅋㅋ
10,끝까지 놓칠 수 없는 반전에 반전이 있는 영화
9,예고편이 아쉽다 영화재미 반감
10,그냥 개꿀잼임 ㅋㅋㅋ 영화관에서 보면 관객이 모두 하나가 되는 매직 ㅋㅋㅋ
10,"우리나라에서 흥행하기 힘든 주제인데도 흥행하고 있다는거 자체가 고정관념을 부수고, 반전이지"
8,영화 자체는 재밌었음. 보는 내내 집중력을 잃지 않았고 뿌린 떡밥들도 거의 회수한 듯함. 스릴감과 유머감이 적절하게 분배되어 보는 내내 재밌었음. 다만 개봉전 예고와 광고로 인해 너무 기대치가 높았나 싶음. 전체적으...
10,이 영화 기발하더라 특히 찻잔 젓는 소리때문에 빠져드는 장면 처음봤다 반전3개정도 있는데 2개는 눈치 빠른 사람이면절반 정도에서 눈치채는데 마지막은 봐야 안다
8,마무리가 아쉽긴하지만 전반적으로 봤을때 잘 만든 스릴러 영화.
10,핵꿀잼! 요샌 공포 영화도 독특하게 나와서 좋다
10,와 진짜 꿀잼 며칠동안 생각나서~ 새벽에 다시 한번 제대로 봐보려구요
10,곡성 같은 기괴 미저리 같은 답답함을 믹스해놓았다
10,중절모 흑인 강동원닮음 ㅋㅋㅋ
9,조지나랑  로지엄마가 굉장히 인상깊어요.
9,"맛있게, 재밌게 잘 만들어진 영화입니다. 굿~~"
10,"전반 흡입력 쩔, 중반 호기심 바짝, 후반 심장이 쿵쾅"
10,영화를 보는 중에는 긴장하다가 다 보고나면 더 무서운 영화.
10,감독이 통수의 통수의 통수 코드네임 블루베리 파이 ㅋㅋㅋ
8,반전에 놀라고 진짜 신선한 스릴러물
10,할머니랑 할아버지 였다니 ㅎㄷㄷ
10,와....진짜....처음엔 살짝 지루한데....가면갈수록 나 미치는줄... 무섭다..뭔가 그냥 무섭다...그리고 ㅈㄴ 재밋다
9,결말을 알고나면 헛점이 보이지만 전반적으로 깔아놓은 떡밥과분위기로 충분히 재밌게 봤어요 색다른 공포영화
10,몰입도 미쳤다ㅠㅠ 당구공으로 뚜까팰때 사이다
10,그냥 포스터에 써진 말들이 과장이나 광고가 아니란것 실제로 저 말 들이 그대로 나오는 영화
10,요새 어느 영화를 봐도 집중이 잘 안됐는데 밤새고 조조로 본 영화인데도 1시간 44분이 30분 처럼 느껴질정도로 엄청 몰입해서 봤습니다! 신선한 느낌이라 좋네요. 재밌었습니다 ^^! 이런 류의 영화가 또 나오길 기대...
10,와 대박 싸이코패스 영화이다 정말 충격적이다 가족들의 본색 속셈 실체를 알게됬으니 그리고 내 인생의 최고 미스터리 공포 스릴러 범죄 영화이다 개꿀잼이다
10,손에 땀이 날 정도로 소리인지른게 용합니다 남자친구는 너무 무서워서해서 제가 달래줘ㅛ어요
10,진짜 시간 가는 줄 모르고 봄 ㅜㅠㅜ대박재밌음 ㅠㅠ
10,안 그래도 미칠 것 같은데 영화 처음과 끝에 수미상관 마냥 반복되는 노래가 날 더 미치게 만든다.. 영화 끝나자마자 엔딩 음악 듣고 뛰쳐나오게 만든 영화는 이게 처음인 것 같다
10,진짜 졸리지만 평점은달고자야겠다 완전핵꿀잼 기존에못봤던 색다른내용이라 더재밌었음 진짜배우들 연기소오름
10,심장이 콩닥콩닥 넘  스릴있고 현실감있는 공포영화에요~ 강추!!!
10,처음부터 끝까지 재밌다
8,흑인남자들은 함부로 백인 여자랑 사귀지 말라는것 같기도 하고.. 새로운 방식으로 인종차별 하는것 같기도 하고.. 공포영화같기도 하고.. 스릴러 영화 같기도 하고... 하여간 볼만했다.
10,심장이 쫄깃해지는 기분이였어요 간만에 재미있는 영화봤습니다
10,기대를 너무 많이 하고 봐서 너무무서웠다...
10,"내인생 최고로 오지는 영화. 자신을 통제할 수 있는 정신이 밑으로 꺼져갈 때에 느끼는 그 절망, 공포, 쇼크의 연출은 어디서도 본 적이 없었다."
8,요즘같은 영화 시장에서 이정도 선방이지
10,너무 재밌고 소름끼쳤어요ㅠㅠㅠ
10,"잘 만들어진 영화는 맞지만 너무 무서워요ㅠㅠ 진짜 너무 무서워요ㅠㅠ스포,예고편안보고 간걸 너무 후회해요 ㅜㅜ저같은 쫄보는 보지마세요..."
10,끝나고 영화관에서 겟아웃해야하는 영화
10,숨은 의미들이 많은 영화. 정말 신선했어요!
10,사람들 눈동자연기가 너무무섭지만 재밌습니다!!ㅋㅋㅋ
10,신선하다는 평이 가장 어울릴만한 영화에요!
10,신선하고 질질끄는것 없이 깔끔했어요. 최근본 영화중 최고였어요
10,참신한 공포영화 소재도 참신하고 배우들이 연기를 잘해서 재밌게 관람했어요
9,지루할 틈 없이 이야기가 진행되서 좋았습니다.
10,장르의 모호함이 주는 신선함? 우정은 위대하다.
8,난 두번봤다 꿀잼이다.
8,그냥 미친영화다..  심장 안좋은 분들은 보지마요.. 근데 제대로 느끼려면 영화관가서 보는게 맞음.. 감독은 백인에게 호되게 당했던적이 있는듯..
10,엄청난게 튀어나왔네!
10,1회차에는 그럭저럭이었는데 2회차 볼 때는 소름 돋는 장면들이 많아서 놀람
10,많은걸 느끼게 해준 영화입니다.
9,이런 영화가 정말 잘만든 영화지..
10,중간중간 깜짝 놀라는게 많은영화 흑인 연기가 영화를 살림
9,신선하고스릴있고연기력좋고~~
10,마지막에  너무 급하게 마무리된감이 있지만완전 신선하고 꿀잼이었음!!
10,흑인연주가가 왜 코피가 나고 발광을 했는지...뇌만 백인이고 몸은 흑인이였으니...잠재의식속에서는 내 자신이 흑인인걸 인지하는거지...
10,짝짝짝 재밌네 독특하고
10,평점이  불한당을 이겼으면 좋겠다
10,무언가 차별하는 것은 잘못된 이치입니다. 인간은 누구나 같아요. 혹시 우리의 언행으로 기분 나쁘게 생각 할 누군가에 대해서 고민 해봅시다.
9,분위기가 압도하는 영화
10,개쩐다 진짜.. 겁나쩌는 영화
10,"재밌으면서도 겁나는 영화, 이래서 극찬받았구만"
10,조던필레의 천재성이 돋보인 영화 데뷔작
10,2차 찍으러가려구용 알고봐도재밌을듯
10,"남다른 연기, 탁월한 연출력, 미국에서 극찬받는 이유를 알겠다."
10,충격이 가시지않는다. 단순히 무서운 영화로 소비할 이야기가 아니다.
10,강렬한 장면들과 감독의 씬스틸러 장면 ㅋㅋ 하나도 놓칠 수 없네
9,하 예고편에서 1차 스포당하고 사람들 평좀 보려했다가 2차 스포 당하고 봤음에도 소름 돋는영화였음 스포만 안당했으면 지렸을텐데 아쉽구려
9,입소문 기대해도 좋을 영화....
10,"백인만 나왔다면 단순한 어쩌면 뻔하고 재미없을 수도 있을 삼류영화 스토리인데, 흑인이 주인공이다. 인종차별이라는 사회문제를 스릴러라는 형식으로 잘 풀어냈다. 신선했다."
10,이건 단순 킬링타임 영화가 아니네
10,이건 꼭 보고나서 바로 한번  더보세요 그래야 더 재밌음
10,너무 재밌었음ㅋㅋ여자친구랑 같이 볼 영화는 아닌듯혼자 보세요
10,혼자 쫄면서 봤는데 ㅋㅋ 정원사 뛰어오는거 빼면 혼자도 볼만함
10,후...진짜 뭐라 표현할수가없네 ....말도안된다....최고
10,묘한분위기에 만점안주면 몇점을 줘야하나
10,재밌었다 인간적으로 ㅋ
10,"사람들의 행동을 통해 암시하는 스릴러,긴장감정말 좋은 영화다"
10,좋았어요. 많은 생각을 하게되네요
10,우와 진짜 최근에 본영화중손에 꼽는다진짜강추!!
10,"시사회 보고 충격적이어서 한번 더 봤는데, 두번 보니까 더 이해되면서 더 충격 ㅋㅋ"
10,어떻게 될지 알면서도 당한 느낌이야
8,재치와 긴장감 그리고 통쾌함까지 갖춘 것이 많다.
9,현실에서도 일어날법한 무서운 상상
10,"연출, 연기 다 좋았는데 진짜 브금이 최고 ... 나까지 어디 깊숙히 빠지는 느낌"
10,"미스테리스릴러 좋아하는 분들이 보면 딱 좋을듯, 전개도 빠르고 몰입감 쩔고"
10,잔인한 장면 별로 없이 무서운 영화였다. 으 뭐야.. 하면서 계속 보게됨
10,전 이런 호러? 영화 좋아요 ㅋㅋ 뭔가 분위기가 묘하고 으스스하니
10,정원사땜에 심장 내려앉을뻔!!!다들 놀랬음 ㅠ_-
10,정말 새롭다!신선하다!재미있다!
10,30분 정도 밖에 안본 것 같은데 왜 2시간이 지나가있지...?
10,천재구먼~~ 심장이 쫄깃쫄깃
10,리뷰 어떤 미친자가 뻘소리해놧는데 진짜 재밌음 보고 후회안함 장지딤
8,꺼져 으오으이오어으..천잰데?
10,귀신보다 사람이 제일 무섭다.
10,이 영화의 깊이를 내 느낌에 1/3 정도 흡수한거같은데 그럼에도 불구하고 천재가 만든 영화라는 느낌이 든다
10,처음으로평점쓰는데 페북에서홍보를너무많이해서반신반의했는데 진짜 보길잘했다는생각..!!소름
10,시간가는줄모르고 봄..
10,소오름~~ 꼭 봐야할 영화! 은근 사이다~!
10,간만에 영화다운 영화봄
9,결말이 깔끔해서 속시원~ 괜한 긴장했네요 ㅋㅋ
10,감독님께서 장르를 막 가지고 노시네요 ;;
10,스토리가 좀 예상되지만 워낙 스릴있게 잘만들어서 충분히 제값합니다
9,와 예고편에 이 영화의 모든게 다 들어있네ㅋㅋ예고편 안본게 정말 다행이다
10,꼭 볼만한 영화네요. 엄청 기대하고 봤는데도 재밌었음!
10,마을 입구 경찰과의 장면을 되새겨 보게 되네요.
10,곡성같은 분위기. 오랜만에 손에 땀을 쥐었네요!
10,교묘하게 차별하는 게 현실과 다르지 않아 역겹더라. 얼마나 억울할까..얼마나 억울했을까..
9,예고편이 거의 영화내용이긴한데 bgm이나 영상기법이 되게 몰입되게 만들어줘요
9,생각보다 재밌었지만 징그러웠다 따흑
9,보다보면 혹시 이러지 않을까? 했던게 실제로 일어남. 끝나고 주변 사람을 다시 한번 훑어보게 됨 ㅋㅋ
10,귀신공포보다 무섭게 심리를 건드리는 스릴러가 여기있네
10,대다나다.. 모든 복선들이 다 연결이 되다니요~b
10,최근 미국의 코로나대처상황과 백인경찰의 무자비한 흑인살해사건등을 접하며 다시 감상한 영화.이제는 선진국의 기준을 재설정해야 할 필요성을 느끼게 되는 부끄러운 자화상을 흑인감독의 눈으로 냉철하게 그려낸 수작!
8,흑인을 하찮게 도구로 여기지만 그 뛰어난 신체는 갖고 싶은 탐욕.. 인종과 별개로 인간이 가장 무섭다 어스부터 참 독특하지만 기발한 제작진들도 무서워
10,긴장감 있게 너무 잘 봤어요
10,연기를 너무잘해서 무서웠어요 ㄷㄷ
8,"체면에 걸리는 순간부터 전체 시나리오가 읽히지만, 흑백 갈등 문제는 잘 다룬것 같고, 특히 맨 마지막에...초반에 출연한 경찰이 출동해서 흑인 주인공을 사살하는 비극으로 끝날 줄 알았는데, 재치있는 인종 차별에 대한..."
9,긴강감 속에 묻어난 흑인들의 참담함
10,"'정말 무서운 영화'로 손꼽히는 것에 진짜 동감하는 작품. 영화 내내 무서운 장면은 없지만, 곱씹어보면 겉만 하얗지 속은 시커먼 로즈와 아미티지 일가의 '사상'에 기함하게 되면서, 마치 ..."
10,진짜 모든 장면하나하나가 복선이고 뜻이담겨 있음 명작인정
10,백인여자 총맞을때 통쾌상쾌
10,나 무셔워 이거 정말 무셔워 근데 보고 싶어 눈감고 볼거야
10,악 너무 재밌고 감동적이야
10,와~~보삼..이렇게 천재적인 감독이 있다니~
7,끝에는 속이 시원하네ㅋ
10,짱 잼. 어찌보면 개그영화 같기도ㅋㅋ. 백인 여친집 가지 말라는걸 극한으로 표현한 개그..으..
8,너무 무서웠어ㅜㅜ 크리스 무슨죄야
10,TSA 능력이 쩌네요 또한 스토리 정말 대단해요
9,새로운 장르의 공포물의 탄생이다. 귀신 하나 나오지 않았음에도 이렇게 무서울 수 있다니. 싸이코패스의 등장도 없었음에도 이렇게 무서울 수 있다니.. 정말.. 연기가 너무 소름끼친다.
9,"흰 피부가 과거에는 인기였지, 한 200년 동안 말이야. 그런데 이제 시대는 바뀌었어. Black . 검은색이 유행이야."
10,오랜만에 재밌게 본영화 소재 자체가 신선하고 생각치도 못한 반전 ㅋㅋ 어스도 봐야겠음
10,흑인쩌리친구 없었으면 이 영화는 속과 겉이 완벽한 만두에 소스가 사라진 느낌이었을 것이다.
10,그냥 이건 꼭 봐야함 두번세번 보면 더잼잇을듯
10,또봐도 꿀잼존잼 의미를 알고봐도 소름
9,어우 섬뜩해 .. 재밌네요  어느 한장면 허투루 된것도 없고 관객이 저절로 집중하게 만드는 놀라운 각본 편집력 영상 배우들의 연기 .. 처음 마지막 음악도 좋고
9,모르고 봐야 더 재밌고 난 감정 읽기 어려운 크리스보다 상황에 맞게 변하는 로즈 연기가 인상적
10,커피잔 휘저으면 바로 최면에 걸리네 ㅋ
10,신선한소재 연기 그리고 액션
10,뭐 디테일이고 자시고.. 영화 몰입도랑 신선한 공포 그리고 영화 진행되면서 나도 모르게 추리하면서 소름돋는... 심지어 영화가 끝나도 계속 숙제처럼 추리하게 되는 이런 영화는 처음본다.. 그래서 10점이다 쩐다 꼭 ...
10,어스를 보고 다시 한번 느꼈다. 이 영화 정말 잘 뽑힌 영화라는걸.
8,침전의 방 속에서 고통 받고 있었을 영혼들을 생각하면 더 소름 돋는 영화
10,정말 명작. 재밌습니다
10,진짜 감탄만 나온다 진짜 안본게부럽다 하...다시볼때의 그 기분을 느끼고싶다 미ㅡ친영화다
10,정말 소름끼치는 작품이다!! 그대들에게 자신있게 추천한다!!
10,인간의 공포심과 심리를 교묘하게 써먹는다는 설정이 제일 무섭다 두번째로 할아버지 뛰어댕기는 알수없는 갑작스런 상황이 무서움 악역들 처단할때는 주인공에게 너무 몰입했는지 통쾌하고 진행도 빠르고 속시원했음..공포에 대한...
10,두번째 보는데 보고나니 가슴이 꽉 막힌 느낌
10,잘만들었다 우와우 각본굿
10,스릴있더만. 중간부터는 심장이 콩닥거리고 긴장감 땡김. 잘만들었는데 왜 개봉때는 안좋은소리가 많았는지 이해안감.
10,졸라잼있음.사실임.
10,"쩌는 몰입감, 탄탄한 스토리, 배우들의 명연기...이 영화는 두번 세번 봐야한다"
10,인생영화 중 하나임어스도 더불어 기대되네요
10,무서운장면 무서운소리 없이도 스토리가 탄탄하고 쫄깃쫄깃함 일하는 아주머니 섬세한 연기가 돋보임 섬세한 공포영화라고 보며됨 추리소설정도
7,수술대에서 의사 혼자서 할수 있다는게 놀라울뿐
8,첨영화봤을땐제대로이해못해서재미없다싶었는데2번째보니 재밌네요
10,재밌네 긴장감있고근데 요즘도 저렇게 인종차별하나
10,이번에 어스도 무조건봐야지!
10,"감독 천재다. 신선도, 기발함에선 식스센스보다 더하다"
