7,크리스가 2층으로 올라갈때 떠들썩하던 1층사람들 갑자기 조용해질때 소름 이장면이 제일 무서웠음
10,배우들의 신들린 연기가 돋보이는 최고의 서스펜스 영화!알프레드 히치콕이 만든것 처럼 보이는. 후반부 수술대기중인 영감이 니 눈으로 세상을 보고 싶다는 탐욕스럼을 보는 주인공의 표정 .  압권이다
10,꿀잼입니다 꼭보세영여여여
10,일상 속의 흔한 인종차별과 점점 고조되어가는 분위기에 보는 사람 숨이 턱 막히고 통쾌한 복수로 깔끔한 마무리를 지어낸 영화
10,장면 하나하나에 의미가 담겨있었음
8,신선하다고 햇지만 나름뻔한 스토리 하지만 재밌게는 보았다
1,s...t...a..y....
7,별로다 뻔하고 재미없다
6,놀랄만큼 독창적이지는 않앗다
10,마음졸이며 봤습니다^^
5,예고편이 전부인 영화 입니다
6,뭐가반전 ㅠ걍 뻔한스토리던데...
7,이런 내용일줄은 몰랐지만 기대가 컷던것인지 좀 억지적인 부분이 있는듯
9,초반에 지루할 수 있는 30분을 버티면 그 뒤로 역대급 충격을 맛볼 수 있다. 더 충격인건 이 영화가 감독의 데뷔작이라는 거
10,정말 신선하고참신한내용이었습니다
3,석양 비치는 해변도로를 40km 달리다해가지고 180km 달리는 어처구니없는 내용전개...
10,미쳤음.. 신선함...보면 알 수 있음
5,흑인 친구가 스포일러. 솔직히 해석이 굳이 필요없는 영화.
5,전체적으로 전개가 빠름   어어어 하다 결말   기대치와 긴장감이 올라가다  100까지 찍지못하고 80에서 끝나는 느낌
10,와 원래 리뷰평점 안남기는데 이영화때문에 남김 영화보는동안 시간 가는줄모름 영화보면서 폰한번도 안쳐다봄 쫠깃쫠깃 최고네 ㅋㅋ 다시보고싶음
10,그 할아방구 뛰어올 때랑 웃으면서 눈물흘릴때 와.... 소름
5,그냥 B급 미국영화. 노잼 노스트레스
8,"라이트아웃,인시디어스,컨저링보다 나를긴장하게한영화"
4,예고편이 다한영화는 처음이엇다 그래서더 실망스러웟답 기대치엔미치지못하는영화 ..ㅠㅠㅠ
7,재미있게보긴했는데 큰기대는안하셨음요ㅎㅎ옆에자는사람들많았음 나름신선한영화 인종차별에대해다시한번생각하게되눈영화입니다
5,뭐 이렇게 까지 높은 평점을 줄 이유가 있을까? 진부하고 뻔한 내용인것을...
8,무슨 반전이 있다는건지.. 사람들 말보고 끝까지 반전 기대했는데 그런건 없음. 그냥 진행방향대로 쭉흘러감. 세세한 복선들은 인상적임. 그런데 그 복선이 영화의 흐름에는 그닥 큰 작용을 하지는 않음. 잘 맞아 떨어지는...
2,"로튼토마토 99점 받은게 전혀 납득되지 않는 영화다. 흑인 인종차별과 무관한 문화권에 살아서 뭔가 이해하지 못한게 있는지는 모르겠다만, 인종차별에 대한 메시지를 빼놓고 영화로써 평가하자면 스토리도, 연출력도 딱히 특..."
8,솔직히 말해서 한국 영화 보단 재미있지ㅋㅋ
4,신선한 소재... 정말 그거 하나뿐이다. 친구의 하드캐리 제외.
5,뭐..다들 아는 그것에서  멈춤니다ㅋ뭐 엄청난 반전은 아예없음  쓸더없이 평이높아요  조조로 보긴딱좋음ㅎ돈자주고 보믄 바보짓
6,예고편이 끝인 영화..신선하다며 띄워줬는데 B급 그 이상 그 이하도 아닌 영화
5,평소 스릴러를 즐겨보지 않는 분들에게는 평점이 높을 것같아요 하지만 저처럼 스릴러 매니아에게는 그저 평범한 영화 중 1편 일뿐 뻔한 스토리에 크게 감흥은 없네요
10,이 영하 터질만 하다. 왜 진작 개봉 안했나
10,예상가능하면서도 이렇게 재밌는 영화는 처음이다 ㅎㅎ
9,여주가 뒤로 갈수록 카리스마가 ..
9,시리얼고급스럽게 먹는영화
7,로튼 지수도 높고 곡성같은 영화래서 기대하고 봤다가 실망했음;; 그냥 전형적인 미국 스릴러 영환데 ??? 재미는 있습니다. 깔끔한 마무리..
10,파티때 검정색 차에서 백인들 내리는거 보고 흑인몸에 백인들이 지배한다고 느낌 나만 알았나?
9,자꾸 미국판 곡성이라는데 곡성은 겟아웃에 비비지도못할영화
10,예고편 절대 보지 마세요
6,호불호가 많이 갈릴듯합니다 개인적으로 매우 불호입니다..
10,이건 미쳤다. 감독이 천재다. 영화를 본 후 기승전결이 완벽한 영화라는 생각밖에 들지 않았다. 남자친구가 보면서 손에 땀을 쥔 영화...!
8,스켈레톤 키가 없었다면 더 높이 평가받았을 스릴러.
7,흠냐..중간까진진짜좋았는데!영화특이하고..남편이랑같이보면서도 뭐지?뭐지?다음내용기대되고흥미진진하고그랬는데~하반부부터급!재미없어지고..허무한결말..ㅠ
10,"마지막 주인공의 한방, 속시원 ㅋㅋ"
10,"백인감독이 만들었다면 천재감독이라고 호들갑을 떨었을 영화! 냉정히 평점 8.7~9.1사이로 보지만, 현재점수가 너무 후져 10점 놓고 감."
10,"개좋다 미술, 카메라 워킹, 음악, 떡밥, 연출 다 취향 저격 탕탕 당해버림. 갠적으로 음악 역할이 컸다고 생각하기때문에 영화관 추천합니다. 저도 제값죽고 영화관에서 떡밥 하나하나 되새기며 다시 볼 용의가 있음"
9,관객을 놀이기구에 태운다최고의 롤러코스트를 태우기위해 타기전의 기다림과 타고난후의 쾌감이 정확히 맞아떨어진다감독의 다음작품또한 기대되게만든다
9,스토리 하나는 정말 신선했다. 다만 예측가능한 전개가 아쉽다.
10,"조던 필레를 웃기는 형이 아닌 대단한 감독으로 각인시킨 작품이었다. 연출, 음악, 스토리, 복선...어느거 하나 빠질것 없이 간만에 완벽한 스릴러 한편을 보았다."
10,예측가능? 그러나 묘한 분위기와 소름돋는 장면들은 예측불가
10,"진짜 이게 첫 스릴러 영화 연출이라는게 믿기지 않을정도, 감독 천재다"
9,"말 많은 영화라 일단 봤는데, 그냥 빠져들게 되더라"
9,다른영화들과 비교불가
8,결말 예상한거가지고 뭘 대단한거 마냥 ㅋㅋㅋㅋ 영화 흐름 따라가다 보면 대부분이 예측할 수 있는데 ㅋㅋ 하여간 반전 타령만 하는새기들 ㅉㅉㅉ
5,루즈한 소설. 뻔한 떡밥.
6,존 말코비치 되기 다운그레이드 버전
5,신선하긴 한데 전개가 너무 뻔함  고퀄킬링타임용
8,다들 경찰차엔 백인이 타고 있었을 거라고 생각했을걸.
6,솔직히 점수엔 후한 편인데.. 보시면서 반전 예상하시면 아마 예상하시는대로 전부 맞을겁니다 나름 신선한걸 들고 나와서 기대하고 봤는데 오~ 할만한건 배우들 연기력뿐.. 생소한 얼굴들이 많은데 연기는 정말 소름 끼치더...
10,완전 재미잇게 잘보앗습니다
10,"신선한 공포영화, 차별은 정말 인간만이 할 수 있는 이기적 심보의 발현 그 자체이고 그 이상도 이하도 아님"
10,진짜 왠만큼 평점 안쓰는데 이건 쓰게 됨.정말 말이 필요없는 최고의 영화!별은 왜 5개가 최대인지...별 100개 드림.진짜 겟아웃 처음에 보다가 중단하고 재밌다는 사람들 속으로 욕하고  여친하고 다시 제대로 봤는데...
10,최고의 영화 인듯 합니다
10,생각보다 평점이 낮네요? 너무 즐겁게 봤습니다. 극장에서 봤다면 더 좋았을텐데.. ㅠㅜ
10,신선한 충격 ())))()
10,이제서야 본 걸 후회함 ㅠㅠㅜㅜ 꼭 보세요
10,이걸 왜 이제 봤지.. 진짜 참신한 영화
10,조던 필 감독에 빠지게 된 영화
8,몇 번을 봐도 재밌음 주인공보다 아미티지 가족 연기 너무 잘함ㄷㄷㄷ
10,반전이 소름... 올해 최고의 영화
2,예고편에서 너무 많은것을 보여줘서 아쉬웠어요..
1,최면에 걸려서 내가 잠들었네;;
7,하도 떠들썩하길래 꽤 수준 높은 의외성을 기대했는데..기대보다 훨씬 못 미치는 느낌. 시시하게 끝남. 두 번을 봤는데 두번 다 중반 이후 졸았다. 이게 인생 스릴러라는 사람들는 나이가 어리거나 영화를 별로 안 본 사...
2,그냥 아웃! 내가 멀  기대했을까..
1,봤던 영화 중 손에 꼽을 정도로 최억인 영화호불호 심하게 갈릴 듯 ..
2,에고 먼가 싱황전개가 빠르다고 해야하나?? 주인공에 반격이 너무 빠르게 해서 그런지 몰라도 너무 어이없음그냥 예고편 으로 즐기면 되는 그러한 영화임 이걸 영화관에서 내 돈주고 보면 진짜 먼가 허무할듯;;
2,그저 그런 삼류영화였다
3,이 정도 평점은 아닌듯... 반전도 시시하고.. 딱히..
8,sns에서 띄워준것 만큼 재밋진 않다. 오히려 돈이 아까울 정도로...
6,후반부에 너무 뻔한 결말+급전개
3,하..진짜 평점 보고 겟 아웃 보러 갔다가 진짜 극장에서 겟 아웃 할뻔했네.. 도대체 뭐가 볼만 하다는 거냐...1도 재미없더만
5,너무 기대하고 봤나 재미없음
5,그냥 무난한 영화임 걍 봐도않봐도 뻔한 뒤로갈수록 전개가 빨라지깅하는데 뻔한내용임 중반까지 졸려죽는줄
4,생각보다 노잼인게 반전 꼼꼼히 설치해둔 맥거핀들을 빼면 정말 별볼일 없는영화
10,정말 역대급 반전 열글자
10,제인생 탑5영화였어요 중간에 복선이있어서 소름돋고 더 재미있었어요 보면 절대 후회안할영화 추천해요!
7,오늘 보고왔습니다.로튼에서 너무나도 평점이좋아 엄청기대하고 가서 그런지.생각보단.그저 그랬습니다...보신분들은 어느정도는 공감하실겁니다.감독이 반전을 노린거같은데..중반정도되면 대충다 눈치깔정도로 흐름이 이어져갑니다...
10,역시 사랑보단 우정이지.
2,평점이 너무 높다..그닥..불쾌한 영화임..내용도 중반까지만 탄탄하고 마지막 후반부는 대충 뚝딱 만든것같음
1,정말 허무함 정말로..
1,미친 이게영화냐? 존나 그냥 주인공 탈출기잖아
10,오랜만에 정말 영화다운 영화를 봤네요.. 저는 재밌고 되게 깊은 뜻이 있는 영화라고 생각해요 진짜 감독 미친것같습니다.. 할머니 할아버지 내용도 프리뷰로 나왓으면 좋겠어요~~!!!
2,뭔가 있을것처럼 이것저것 많이 깔아놓고 노잼 급결말
4,반전이라기엔 힌트가 너무 많다. 예상이 맞았다는 잔잔한 즐거움은 느끼겠지만 극적인 반전을 기대했다면 실망할듯. 마지막에는 약간의 카타르시스를 느낄지도.
5,굳이 극장가서 볼 영화는 아니고...감히 곡성에 비할바는 아닌듯.
8,인종차별이라는 신선한 소재와 반전도 있고 효과음땜에 더 몰입한듯ㅎㅎ
3,난 이제부터 로튼토마토지수 따위는 절대로 안믿기로 했다..한마디로 핵노잼!!!
6,별로던데..생각보다 평점이 높네요..볼만은 합니다.
10,흑형 주인공 멋있다 지려
10,평점이 왜 이렇게 낮은거야
4,다 좋아 근데 최면이 너무 쉽게걸리는게 마이너스포인트. 티비앞에 앉혀놓고 다 설명해주는것도 구리고
1,너무 뻔한스토리 ... 실망했어요
1,예고편 보면 다본듯...언플에 놀아나지 마시길
1,진짜 너무 졸림. 뒤에 있는 사람 코골면서 잠. 중간에 잘까 하다가 돈 아까워서 안잤는데 리얼 돈낭비 미국판 곡성이랬는데 걍...ㅇㅂ 노잼
1,너무뻔하고 무서움이 없는영화
2,"예고편이 다에요.... 평점보고 괜찮다해서 봤는데... 영화 보는 내도록 지루하고 졸렸어요... 소재는 너무 좋았지만, 잘 못 풀어낸 느낌...? 보고 나니... 내 정신이 이상해진 느낌...;;"
1,뚱땡이 친구가 도와주는 과정이 너무나도 허무맹랑해서...다 망쳐버림.
10,귀저귀 차고 보세요. 10자.
2,뻔한 반전과 식상한 전개가 아쉽네요
2,더럽게 재미없어요  ㅇㅅㅇ
2,그냥 2000년대 초중반? 그때 양산되던 B급 C급 반전영화들이랑 다를게 없다.
10,네이버에 겟아웃을 검색했을때에 영화정보에 너무나 간단한 줄거리가 있어 볼까말까 고민했다.보길 정말 잘했다. 절대 후회하지 않을 영화.영화를 보고난 후 복선 검색해보는 재미도 쏠쏠하다. 최고!
5,비급영화수준에 킬링타임도
5,뭔가 평점들 대단한무언가있는것처럼 일부러 쓰시는건가..?  초중반쯤 혹시그거..?하면서 생각한 몇가지가있다면  그게내용이던데 ...그래도 여주이쁘고여주엄마카리스마쩔고 군데군데소름..빙고할때윽.. 재미는있어요~극장서...
1,더게임 안봤으면 5점  봤으면 1점
1,생각했던 것보다 노잼..
1,내 취향은 아니었다 내 취향은
1,솔직히 노잼이다. 이딴 영화로 어떻게 이런 관객수를 동원하지? 이해가 안된다
1,초반부터 지루하게 전개되면서 흥미를 끌지 못하는군
2,어이가 없어서 내가 영화를 잘 못 본건가 싶어 인터넷 글을 다 찾아봤지만 별로 와닿지도 않는 인종차별 해석 이야기들 일색에 전부 뻔한 내용들 뿐 이었다. 내가 제일 싫어하는 영화 특징인 내실 없이 깜짝 놀래키기만 하...
6,"같이 본 친구들도 그렇고 다들 재밌다고 난린데 나만 그랬을까..나만 졸렸던걸까... 처음부터 끝까지 이렇게 되겠구나 하면 진짜 그렇게 되고.. 내가 스토리 쓰는 줄 알았다ㅜ 다만 주인공이 생각보다 멍청하지 않았고, ..."
2,알바들한테 댓글에 속아 봤다 평소에 공포물 스릴러 엄청 좋아하는데 이건 그냥 흑인이 불쌍한 영화 평점이 이렇게 높은 이해 1도안됨
4,ㅂㄹ..호들갑다떨더니 스릴1도없음..
1,전설의고향이 더무섭습니다...
6,별로.. 재미 없어요.. 광고에 속지마세요
5,으음 일단 결말이 너무 허무하다 임팩트도 별로 없고 곡성과 비교했을때 곡성이 훨씬 더 재밋는거 같은데..더 절박해보이구 중간까지늑 재밋게 봤는데 그이후는 별로..
6,역대급이란 말에 혹해서..봤는데..무섭지도 않고..충격적이지도 않고..결말도 예상가능한데..흠..
1,내 돈 주고 봤으면 억울할뻔
1,알바 많이 풀었네 ㅋㅋ 뭐 이딴 영화가 8점대야??서론 1시간 본론 25분 정도 이정도면 영화설명 다 됏나? 영화는 총 90분타임참 어이없고 황당합디다 지루하고 한마디로 보지마세요
1,재미한개도 없구만   노잼
1,예고편이 모든것이다. 영화관에서 겟 아웃
5,기대가 너무 컷던지라..생각만큼은 아니였던거 같애여...근데 주위에선 재밋엇다고들 하던데! 후회하진않아요ㅎ
1,부부의날을 망친영화 와이프가 스릴러 공포 좋아해서 평점보고 본건데 전혀 긴장감도없고 지루해서 집사람 자버림 평점이 왜 높은건지ㅜㅜ 소재만 신선함
1,머그컵 숟가락 꿀잼 +1점 줍니다
1,"응어어어,어어어,어 걍 노잼"
1,진짜 시간 아까움.. 전부 다 오버쟁이들만 나옴..
9,묶인 선으로 솜을 어떻게? 그래서 1점 감점
1,예고편만 보는게 나을수도.. 배우들 연기는 좋았지만 내용이 반전이랄것도 없이 너무 뻔했고 후반부가서 현실성 훅 떨어지고 허술하고 사건 수습도 안 하고 급마무리 지어 허무하게 만듦
3,"영화 포스터만 봐도 내용, 결론 다 드러나고 뒤통수 칠 반전 하나 없음. 러닝타임 약 1시간 40분중에 하이라이트(본격적 내용의 시작과 결말)는 고작 25-30분임. 당신이 영화감독이라면 시간분배를 이렇게 했을까?"
6,부랄친구가 살렸네. 근데 기대 이하.
1,"다들 극찬 일색인데... 정말 재밌어서 자진 평점 써대는건지 진심으로 궁금합니다.그냥 홍보글인지, 수준들이 이 정도인건지...여기 글보고 본 영화인데 낚인거같아 정말 짜증이 나네요꿈보다 해몽이라더니 어이가 없네"
1,결말에 대한 고민의 흔적이 보이지 않는 영화
1,평점 5점이상준사람들 이해안가네요세상에서 제일재미없던영화초반에엄청지루하고 끝도 개허무돈아까워요 나중에 공짜로나보세요
1,진짜 개노잼 ; 너무 기대한 탓인가 뒷내용은 너무 갑작스럽게 막 전개 되고 앞내용은 개지루 돈 날리고 가네요 ;;
1,보고나서 돈과 시간이 아깝다.
10,김치들 종특: 극찬받은 저예산 해외영화들은 일단 까고본다. 왜냐? 난 특별하니까^^ 극혐새끼들
1,그냥 한마디로 표현할수있다 겟노잼
1,저만 이해안되는 장면이 많았나요? 왜 흑인여자가 휴대폰 충전기를 뺐는지등등...그리고 결말이좀 허무한 느낌이네요 그냥 쾅쾅거리다 끝난 느낌...
4,좀약간 애매했어요 !!!!
1,뻔한내용 뻔한결말 1위속아서봄 ㅡㅡ진심 기대하지말아요
1,"좋은 소재로 억지설정 , 복선, 반전 범벅 에도 메시지 가 없음. 요란한 띄워주기;;"
1,볼만합니다 근데 기대이하입니다
6,호들갑 떨 정도는 절대 아닌데 마케팅 제대로 됐네 ㅋㅋ
1,북미 pc충들 때문에 너무 고평가된 영화 참신하기는 개뿔 재미와 참신 둘다 없다 곡성이 헐리웃에서 나왔으면 상 다쓸었을듯
1,이걸 예상 못하는게 더 이상함살인의 추억이 10배는 더 나음 그냥 인종차별 문제를 잘 다뤘다정도
1,재밌다고? 어휴... 같이 보자고 했다가 시간 아까웠다고 욕먹음. 돈만 날림.
1,별로 그냥 별로 잠자기 좋음 크
1,여기에 뭘얻었네 반전이네 다시생각하니 소름이네 하는것들  평점믿지마세요.첫째 지루합니다.둘째 개연성부족.셋째 솔직히 킬링타임용도못됨 당신의시간은 소중하니까요
1,왜 곡성처럼 해석이 필요한 영환지 모르겠음  완전 유치함 . 내용이 매끄럽지도 않고 중간없이 처음 결말만 붙여놓운 느낌 . 처음엔 뭔가 있는것처럼 겁나 미스테리한느낌 근데 그것고 너무 뻔해서 뭔가있겟지 있겟지 하는데...
1,"개뻔한 반전, 여자통수칠줄 알고있었음.  그리고 깝놀때매 개빡쳐서 1점줌"
1,그냥 그냥  뻔한영화  중간중간 놀래키기나하고 별로요~
1,이게 재밌냐??이게?
1,올해 본 영화중 최고로 졸린 영화다
1,진짜 좀 어이없음...앞에놀라긴해도 내용도 없고 재미도없고 교훈도없고 음악은 너무 섬뜩하고 돈아까움 왜평점이높은건지 극장에 같이 보던 분들 다 실망해햇는데
1,진짜 평점 안쓰는 사람인데 인생 역대급이라 씁니다.한줄평으로는 흑인이 겟아웃!!!! 이라고 외치는데 그때 우리가 나갔어야 합니다.
1,그냥한줄만씁니다. 절대보지마.
1,OOO기영화ㅡㅡ 이걸 무슨 공포감도없고중간에나갈뻔진짜  여고괴담이더낮겠다
1,존나 재미없음 지루하길래 뭐있겠지 했는데 뻔한 반전... 뭐가신선하다는거냐 시...ㅂ
1,한 치 앞이 보이던 영화.... 내용은 별로지만 배경음악은 좋았어요!! 스산하면서 소름돋고 디테일한 음악덕분에 2시간 겨우버틴 느낌
1,솔직히 재미없습니다. 인간지네1 보다 나을게 없음
1,"예고편이 영화의 전부,,,"
1,진짜리얼후기입니다 영화볼돈으로 복권사던지 기부하던지 맘스터치 싸이버거드세요
1,별로였음..보고 나서 기분 찝찝함 결말도 급 결말지은 것 같고 걍 별로
1,처음에좀 신경써서 만들다가 귀찮아서 그냥 마지막에 다 죽여버리는 아주 형편없는 영화
1,"영화의 홍보, 언론플레이 등등이 관객에게 미치는 영향..."
1,남자친구가 2007년 영화 신하균 변희봉주연 더게임 따라한거아니냐고했음 부정할수없음 상 휩쓸 정도는 아님
1,보고나서 딱 드는생각이 뭐야; 이게 끝?왤케 순삭? 내가 방금 뭘본거? ㅈㄴ 돈아까운생각밖에 안들었다 진짜 워... 보기전에 여기리뷰판 보고 앞쪽에 별10점짜리들 많길래 재밋나보다 하고 보러갔는디 진짜 댓글알바냐.....
1,진심 다 알바아니냐 ? 이게 진짜 잼있었다고 다들 이렇게 평점 주는 것인가 ??? 긴장은 커녕 스토리도... 그리고 반전의 묘미?? 그리고 뚱띠 친구의 개그 ??? 난 진짜 ...너무했다 싶은데 ....
1,핵노잼 ㅋㅋㅋㅋ앜ㅋㅋㅋㅋ마지막 반전있음 ㅋㅋ
1,광고댓글 장난없네 72점만점에 1점줌 뚱이친구 주연놓고 제목 친구를 찾아라 하고 브금 웃기게 틀면 적어도 72점만점에 2점줬음
1,기대하고 봤는데 별로네요. 내용도 없고 재미도 없고 무섭지도 안네요..이게 무슨 영화인지.. 돈 버린느낌이에요. 보지 않는 걸 추천합니다
1,오 소름 이영화에 평점이 많은게 소름. . . 알바들 영화에 나오는 로즈 보다 더 무서움
1,별 한개도 아까운 영화차라리 공상과학이 더 나을듯이런 영화가 왜 예매율이 높은지 모르겠음
2,영화수준이 초딩수준이다.  미국 국민들의 수준도 알만하다...말도 안되는 스토리를 유치하게 만들었네...
4,최면으로  납치  여친  일가족  납치범  혹인가정부  여친할매  흑인정원사 여친할배  백인들이 흑인들  납치하는 내용
1,로튼 믿을게 못되네. 썩은 토마토인데 ㅎㅎ
1,그저그런 싸이코반전영화
1,"블랙코메디, sf,  어이없는 커피잔"
1,이런쓰레기같은영화 처음봣네 인종차별이야기는알겟는데 팩트도없고 내용도없고 무서운스릴도없고 무서움많이타는데 이거보고 놀라지도 집중도되지도않은영화네 ㅋㅋㅋ안보는게 훨나을듯 티비에서 틀어줘도 안본다
1,내 1만 1천원을 돌려놔라 덕분에 네이버 평점은 믿을만 하지 않다는걸 입증한 영화다.
1,뻔한영화.. 복선이 너무많고 잘라보면 흔한스토리라 뒷내용을 다 알게되든데..내가 영화를 너무 많이본건지; 기대치에 훨씬 못미치는 영화였습니다. 예고편만 쌔리 질러놓고 임팩트만 모아서는; 연기력과 남주의 시원한 결정력...
1,재밌다고 한새끼 나와봐
1,내 인생에서 이 영화를 겟 아웃차라리 영화볼 돈으로 기부를 하세요누가 이거 재밌다고 하면 쌩까자는 말 돌려하는 겁니다
3,빈수레가 너무도 요란하다..
1,그냥 재미없어. 시간위의 집이 백배낫다.
1,걍 삼류 B급영화 더만 평점조작하냐? 그리고 흑인들 피해망상있냐? 인종차별하는건 알겠는데 피해망상증 환자얘기같다
1,뎃글알바진짜있구나 뭐감독이천재?웃기서네보자말자바로댓글써요짜증나서
5,"퍼펙트 호스트 보다 노잼인데 ㅡ.,ㅡ 할머니 할아버지가 시중드는데 긴장감 주려고 의미심장한 미소만 날림셔터 아일랜드 보다도 못함.. 근데 리액션이 좋음 6점도 못하는 영화임.호스텔+오텁시 정도의 영화?"
3,과평가된 영화같음ㅋㅋ
1,신선한 충격이라고 하길래봤는데 진짜 이런걸 돈주고보는 내자신이 너무 신선했어 하하
1,네티즌한테 속앗네요^^
1,"솔직히 기대하고 봤는데, 흑인들 피해의식이 너무 많이 드러났음. 감독도 설마? 했더니..흑인... 아니 백인을 모조리 악마로 묘사하고 흑인은 순진한 피해자로 묘사... 현실과 너무 괴리가 크다."
1,내 맘속에서 get out....
1,평점이 생각외로 너무 높네; 초반부에 주인공들이 하는 대화 들어보면 결말은 예상하면서 보게되더라고요.  특별한 반전이 있을줄 알았는데 너무 기대감이 컸나봐요..
1,B급영화 홍보의힘 한시간졸고  10분 휙  영화끝
1,"백인들은 이런 흑인영화를 '나쁘다,후지다'라고 말하지 못한다."
4,"모든 장치와 의미를 놓친 게 없는 데도 불구하고 너무도 뻔하고, 편한 전개가 아닌가 생각됩니다. 예고편보다 포스터가 과대포장이라고 느껴지네요. 공포를 넘어선 놀라움도 없고, 소름끼치지도 않고, 충격적이지도 않고, 역..."
1,단연코 올해 본 영화중에 가장 최악. 소재는 신선하나 그 소재를 잘 풀어가지 못하고 여러가지 던져만 놓고 수습을 못함.그나마 일점도 이 영화의 음악감독에게 드리는 것 .음악이 아주 좋고 예고편이 젤 재밌습니다. 기대...
1,나가라할때 진짜나가세요 진심
1,몰입도 0 그냥 재미없음
1,재미없는데.... 내가이상한가?
1,"누가 배급하길래,, 이렇게 알바스러운 10점 댓글이 많은건지;;; 10점이 그렇게 가벼운 점수냐? 이건 객관적으로 5점도 못미치는 2류 B급영화다. 균형을 위해 1점을 준다."
5,기대 이하 였던 영화. 예고편이 전부인 영화
1,신박하나 스토리작가가 쓰다가 존듯한 ..
1,내가 최면에 걸린것만 같다.. 제발 보지마..
6,그냥저냥. 코미디물로 생각하고 보면 나쁘지 않음. 생각보단 안신선함 ㅡㅡ
1,진짜 보지마세요 최악의 영화
6,뻔함 뻔함 뻔함....
1,"재미없고, 긴장감도 없는 3류 영화극장에서 볼 수준은 아님!!!"
1,평론가랑 일반인 평점좋아서 봤는데 다들 댓글후기알바하는건지 ㅋ영화보면 허탈해서 웃음밖에 안나오는 영화
