1,"재미만 있고 감동, 교훈, 의미는 개나 준 영화 영화 볼수록 어이없었음 사람들도 끝나자마자 웅성 웅성"
10,반전오지구요 애기연기 핵잘함 진심 대상주셈
10,다시 볼거다... 무뇌충들;;; 이게 7점대가 말이 되냐;;;
10,호불호 갈리네 난 재밌게 봤다근데 잔인하고 매스껍다고 1점 준놈들은 뭐냐스릴러인거 모르고 봣나  애니보러가그럼
10,생각할수있게해주는영화만들어주셔서감사합니다
3,뭘 전달하려 했는지 억지로 만든 반전스토리~~
1,그냥 공포영화. 너무 무서워서 너무 힘들었다. 내가 이걸 왜 봤는지. 엑소시스트+좀비+처녀귀신
6,오 이런 반전이? 싶다가도 영화끝난뒤 생각해보면 억지로 반전을 만들기위해 영화가 길어지느낌..억지 반전이 영화를 망친 느낌.그럼에도 불구하고 모든 배우들의 연기가 아주 돋보여서 좋았음.특히 외지인 역할 일본인 배우 ...
1,평논가평점  보다 관람객평점이낮은영화
1,보는내내지루 설마 설마 곡괭이로머리찍히고  한국판좀비영화이였음 곡성2도 나오겠네요!!!! 앤딩이고나발이고 그냥끝나던데 상관없네요 참 안볼거니까~
1,현실성도 없고 스토리의 개연성도전혀없는  최악의 영화
10,미끼에 걸려들었다. 반전.. 오랜만에 즐거운 시간이었습니다.156분이 지루하지 않을만큼
1,잘나가다가시나리오쓰기귀찮아서 개막장 좀비영화되네 ㅋ별하나주기도아깝다
6,지루 하지 않은 전개지만 매우 산만하다는 느낌
5,초반에는 웃겼고 중반에는 잔인했고 후반에는 밑도끝도 없더라
1,이거보고 몸살 낫어요...
1,전 16살인데요15세이상이라그래서괜찮은줄알았는데2시간36분동안 자리에앉아있기 힘들었어요.19세이상영화안봐봤지만19세 이상 영화가 곡성 같을거 같아요. 끝도 잘끝나지도않고그냥 제작자 들이 재밌게만들려고막 꼬다가 그냥 ...
1,오늘 목동 cgv조조로봄 보신분들 평점 진심 10점인가요?스릴러? 좀비나오는스릴러도있나요? 아 악마도나온다ㅋㅋㅋㅋ 무당도나옴ㅋㅋㅋ 웃기지도않는억지개그도나옴 ㅋㅋ 감독님 존경하네요ㅣㄱㅋ
9,중간중간  코믹하기도하고 두시간반이 지루하지 않은 영화
6,"좀비,악마,귀신,신부,무당 등장은 모두 했는데 스토리적 이해력이 부족하다. 2편이 기대되는 영화가 아니고 반토막 영화를 본 기분이다."
2,재미 하나 없는 영화. 수준은 없고 수사만 난무하게 나열하는 우리나라 영화평론가들의 호들갑에 아까운 영화비 날리지 마시길
1,고의로 관객을 헷갈리게하는 얕은수작의 편집황정민의 굿씬빼고 그냥 데드얼라이브 ?엔젤하트 이것저것 섞어놓았을뿐인
1,할리웃은 툭하면 19 니들은 15????욕을 벌어라
1,최악... 최악.... 핵 고구마 곽도원... 왜이리 영화가 뭔 미끼만 잔뜩 던지고 결론은 관객 몫인가???? 이렇게 돈과 시간 아까운 영화 처음 봄....
1,"선비들만 모였나 뭔 중,고딩들이 악몽에 시달리고 정신적으로 안좋아 ㅋㅋ 멘탈이 쿠크다스들이신가 유치하고 지루하기더 하더만"
1,뭔 내용이 개판이고 술마시고 꼴리는대로 그냥 처만들랏나 이랫다가 저랫다가 뭐 어쩌란거고
1,진짜 보고나면 뭐지..? 라는 생각뿐.. 19금이 아닌것도 이상.. 보고나서 기분이 썩 좋지는 않다..
1,정말짜증나구돈아깝구피곤하구열받는영화인듯...세상살면서정말최악의영화인듯...시간아깝구그시간에치킨사서집에서야구나볼걸...정말후회함...
1,보지마라 공백제외 10자 채우래서 채운다
1,세상에 이런영화일줄이야 진짜 완전낚인기분 진짜 피튀기고 좀비나오지 아오..보는데구역질나오고진심역겨웠음 이게뭔내용인지도모르겠고 이상한장면나오고 영화보다 중간에 나오건 진심처음이였음 졸리고 잔인하고 그냥 보지마세요 후회...
1,평점 1점 올린사람들이 맞음...쓰레기영화~
1,하아 진짜 돈아까운 영화였다. 스토리 개연성도 떨어지고 보지마시길
1,보지마세요ㅜㅜ 아ㅜㅜ
10,나홍진은 추격자때처럼 또 10년을 앞서갔다. 19세 관람가를 했어야 했다. 20대 후반인 나도 어려운데 중학생 고등학생은 이해할 수 있을까?
1,아.... 보지마세요  술먹고 다음날 입 텁텁한 느낌
1,뭐여???뭔내용이여!!내대가리가이상한거여??만원이나주고봤는데!!!
1,덩말로 댸미업고 뜯도모르게떠요
1,별 재미없는 삼류 귀신영화네!!
5,나홍진 감독이라 믿고 방금  봤는데...이게 재밌다고? 이게? 하..
1,개 쓰레기영화. 시간아깝다.
5,이런 저질 영화를 최고라고 생각하도록 관객들을 현혹시킨 것이야말소 나감독의 진정한 능력인듯 회수도 못할 떡밥을 잔뜩 뿌려서 결국 관객을 당황시키게 만든다. 잘만든게 아니라 못만들어서 현혹된다
7,벼락 맞는 씬과  곡갱이 맞고도 죽지 않는 좀비 씬은 코메디였음.
10,"생각하기 싫은 분, 답 알려고 드는 분은 보지 말것. 최고, 소름, 이럴수가, 대박, 참내, 헐, 진짜? 오매, 헉 했던 영화."
10,한국영화의 수준을 한단계 더  끌어올린 작품이 아닌가 생각됨
1,"좀비 나오는 순간 웃었음. 현실감이 너무 없어서 웃기기도 했고 어이없음. 정말, 이게 최선인가요?"
1,"스트레스받는 영화, 그리고 관람등급이 이해가안가네요. 보호자 동반하면 어린이도 볼수있다는건데.."
1,이건 미친 영화네... 일루미나티라는게 이런건가? 보지말아야 할 영화인 듯
1,황정민나와서일점이라도...
1,존나 답답함 뭘 시사하는바가 없음 ㅋㅋ 걍 존나 찝찝함 적당히해라 알바도
1,감독 이발하고 면도좀 하소하구댕기는 꼴이랑 맹근영화랑 쌤쌤이오돈네고 낚여가꼬 기분드럽 ㅡㅡㅋ
1,미치지 않았으나 미친척하는 영화
2,소문난 잔치에 먹을것없다.영화는 인터뷰로 변명하는것이아니라 작품 내에서 모든걸 설명해야한다
10,배우도 감독도 다 미쳤음! 나홍진은 또 한번 자기 자신을 넘었네
6,기대를 너무 많이해서 그런지 약간 부족했지만 그래도 좋은 영화라고 생각해요
1,이렇게 극단적으로 나뉜 평점을 보면 볼 영환지 안봐야할 영화인지 알수있음 10점은 알바1점은 낚여서 화난 관람객안봐야지ㅋ
9,존나무서움진짜 개짜증나게무서워 소오름
5,"이딴 걸 10점이나 주냐...;;; 전문가들이 플롯 어쩌구 하던데 무슨 개풀 뜯어먹는 소리를...ㅋㅋㅋㅋ;;;; 아니 연기 잘하는 배우들 데려다가 무슨 짓하는 건지 도무지 알 수가 없음. 쓸모없이 떡밥만 많고, 이게..."
3,호러?좀비?영화가 끝났는데. 이해가안간다....감독의 해설이필요한것같다.
4,솔직히 보는내내 기대많이하고 집중해서 봤거든요. 제머리가나쁜지 영화중간중간 복선만보이고 잘풀리지도않고 굉장히 불친절한 영화란 생각이 들었습니다. 예술에 예자도 몰라서그런지 연기는 엄청 나더군요.
4,쫄깃한맛을 좋아하면 봐두됨... 하지만 스토리가 망임. 기승전 까지는 있는데 결 이 없음. 연기력도 굿인데 크레딧 올라가면 'ㅇ_ㅇ... 나니?' 하는 반응을 하게됨. 몰입도는 좋은데 끝이 개판임.
1,왜 두번 꼬았는지 이해가 안되는 영화그냥 천우희를 적으로 만들었으면 더 재미있지 않았을까영화 제목은 그냥 지리명에서 끝나는가?전개가 될수록 하나의 점으로 수렴해야 하는데어찌 에라 모르겠다 발산하는 느낌
10,소름돋는 영화네요 참 빠져들게 하는 재미있는 영화네요
4,음...정말 호불호갈리겠네요ㅎㅎ전체적으로는 그냥볼만한데 중간에 좀 난해한 설정들이..^^중간중간 빵터지는 부분이 있어요여러의미로ㅎㅎㅎ무서운거못보시고 비위약하신분들은 생각해보셔야할듯
3,심리적으로 긴장감 주는데는 만점이였는데열린결말을 안좋아하는 저인지라ㅜㅜ...
6,감독님께 묻고 싶습니다 이게 뭐예요?
1,가득 담긴 했는데 다 쏟아버린 영화 중반까지 볼만한데 후반 쪽으로 갈 수록 러닝타임이 긴 이유를 모르겠다
1,보는내내 한숨나오고 중간중간 욕하는거 때문에 웃지 뭐가 뭔지 모르겠다
1,최악!!! 짱나는 더 짱나게 하는 OOOO 영화
1,1점도 아까워요 하지만 누군가 피해를 볼까봐 올립니다 진심 보지마세요 .... ㅠㅠ
1,뭔가 있게 보일려고 만든영화. 작품성 제로
1,이 영화는 진짜 시간낭비 2시간반내내 지루함
1,"내용도 헷갈리고 ,,억지로 잔인하게만 만들려 하고, 엄청 시끄럽고 짜증나는 영화. 실망 그 차체.방금 보고와서 댓글을 안쓸수가 없네요."
1,"1점도아까움....,,"
7,추격자 영ㅇ화같은 스릴러 일줄 알았는데 기대했던거 만큼은 아니였어요
6,그냥그저그런 b급 영화...
1,이게뭐야..재미없다
1,진짜 처음으로 평점쓴다 ㅋㅋㅋㅋ 최악이다 ㅋㅋㅋ 도대체 황정민을 메인으로 세운 이유가 뭔데 ㅋㅋㅋ 그냥 관객동원이잖아 ㅋㅋㅋ 진짜 개재미없다
1,틀린건 틀린거다 다른게아니고
1,불쌍한 까마귀 열자열자
1,이딴걸 보느니 시빌워랑 주토피아를 두번 세번 보는게 낫지.
1,10점 주신 분들은 꼭 몇번씩 더 보셔서 천만 영화 만들어주세요. 부탁드립니다 ㅋㅋㅋㅋ영화 쓸데없이 내용이 길어지고 마지막 20분정도만 정신없는 전개 연출 인상적이였습니다.진지하게 이 영화 보고 싶은 분들은 꼭 보셔...
6,영화보면서 중간에 집에 가고싶다는 생각이 든건 처음이었어요. 영화끝나고 사람들 다 뭐야 하는 반응... 물론 나도. 그나마 배우들이 살린 영화. 나홍진감독이 삘꽂혀서 찍은 말그대로 나홍진영화. 으...실망
1,추론이 난무하는 영화   재미없답니다.
1,1.장르가 코믹인지 스릴러인지 몇번 헷갈리정도로 애매함 2. 좀비물에 귀신에 악마에 퇴마 구마 꺼지 다섞은 잡탕느낌3. 영화가 끝났을때 이게 끝난건가? 애매하고 애매하다 이생각듦 4. 감독이 황정민 이라는 배우를 ...
1,믿고봤다가 개낚임 영화시작전에 낚시하는장면나오는데 우린그냥 물고기였음 진심 개노잼
1,그닥.. 현대차 에쿠스 같은 영화
7,아진짜....무슨영화에요....오늘잠은다잤네ㅠㅠ
1,무신론자들은 그냥 믿고 거르면 된다
8,처음에는 이해가 안됫어요..오ㅐ시작과 동시에 성경책의 문구가 나오는지...이해가 안됫지만 후반에 닭 울음소리에서 알게됫죠인간의 본상과 심리.. 그리고 막상 우리가 닥치게되면 누구나 똑같이 할 일들 영화를 보고저의종교...
10,아 진짜 무섭네 진짜 다같이보는데 혼자 보는것같노ㅋ시간 가는줄 모르고봤네 ... 전부 조용히 집중해서 더 무섭네
10,어찌해야할까 이 긴장과 잔상
8,배우들 전체적인 연기력이 엄청나다다만 러닝 타임이 좀 길다는것은 흠인것같다
1,오키도키노잼도키노잼ㅋ
1,곡성 지들이 평점 알바 쓰다 걸려놓고 영화 재미없다고 쓰면 시빌워 홍길동에서 알바왔다고 헛소리를 하네 ....
1,알바들 정말 많네요 .... 휴 !!  영화나 보고 작성하시죠!!!!
9,두 번 봐도 재밌네. 여자애가 소름끼칠 정도로 연기를 잘하지만 정서에 악영향 갔을까봐 쫌 걱정됨. 마지막까지 누가 진짜 나쁜놈인지 몰르겠어서 곽도원이 집에 갈지말지 고민하는 장면에서 숨 멈추고 봄. 다만 대낮에 좀비...
10,평론가 입장에서 보면 100점도 더 주고 싶은 영화. 관객 입장에서 보면 1점도 아까운 영화. 영화 진짜진짜 잘 만들었다. 영화가 끝나도 관객 뇌리 속에서 오래오래 진짜진짜 짜증나게 만드는게 목적이었다면 감독은 천재...
10,"천우희가 신녀나 수호신이고,  황정민이 악마와 한패였다는게 반전...."
10,"한번.두번.세번.,.볼수록 재밌다.해석이고 결론이고 뭐가 뭐인지간에 그냥 재밌다"
9,국산영화 손꼽히는 명작중 명작
10,"하..완벽한 오컬트영화다. 완벽히 보려면 1.영화를꼼꼼히본후 2.이게뭐지?라고당황한후 3.네이버같은데다'곡성결말해석'검색해서 찬찬히 읽어보면 이 영화가 얼마나 완벽에 가까운지 알수있다.  구성, 촬영은..."
1,별점 주기도 아까워요 도대체 내용이 뭔가요? 어떤방향으로 이해를 하고 봐야 하는지 모르겠네요 정말 배우들이 아까워요 이딴 영화에 저 배우들을..;;
1,복선도 없고 스토리도 불친절 하다. 감독은 그저 관객을 최대한 헷갈리게 하고 싶었을뿐 인 영화  자고로 영화란 한컷 한컷에 의미가 있는 법인데. 곡성은 다수의 컷이 아무 의미가 없다. 보고 나면 기분 나쁘고 시간이 ...
1,무섭지도 않고 전달되는 메세지도 없고 도대체 의도가 무엇인지 고민하게 만든 영화.... 왜 호평 받는지 이해불가네요주변 친구들 다 혹평하는데....
1,일단 공포영화라고 치면 무섭지가 않았습니다. 미스테리영화라고 치면 미스테리 하지가 않습니다. 이 장면 저 장면 전부 집어넣고 니네가 알아서 끄집어내란 식. 필요없는 장면은 그저 혼란을 주기위함? 병맛이네요ㅎ
1,진짜 별로였음 그냥 내용도 엉망이고 반전도 너무 억지고 갑자기 좀비랑 악마는뭐임 장르가 판타지인가
1,1점도 아까운 희대의 쓰레기영화
1,할말없음..돈 아까움..
3,강우석 이끼와 비교도 안되는 졸작. 평론가 평점이 높은데는 다 이유가 있겠지. 추격자 황해는 괜찮게 봤는데 욕심이 앞선듯. 현혹될 거리도 없거니와 뻔한 스토리는 둘째치고 악마 CG인지 분장인지 확 깬다. 알바들 애쓴...
1,특별한거 없는 호객영화
1,예매 미스로 표를 날렸네요 ㅠㅠ
1,진짜재미도읍고 짜증낫어요
1,그냥 종니 재미 없어.. 볼사람들은 가서 보던가 ㅋㅋㅋㅋ
1,영화의 스토리가 기본이 안 되어있다.절때 보지 마세요. 기 승 전 까지만 잇고 결론 없이 그냥 영화 끝남. 영화 초 중반에는 신경 써서 잘 만들다가 후반에 만들기 귀찮아서 그냥 막 내린듯한 느낌. 영화 엉망입니다. ...
1,올해 본 영화중 최고로 기분 더러워지는 영화.좀비물이면 좀 데드캠프 처럼 만들던가..너무 재미없었음.
1,"영화는 아무리 상업적이라 하더라도' 왜?'는것을 의문나게하게 마무리하는것은 역사적사실이 아니고는 하면안되 허접함  """"정말 주인공과 출연진들의 연기가 아깝다"""""
1,인생 최악의 영화. 재미도 없고 감동도 없고 내용도 뭔지 모르겠고 중간중간 깜짝 놀라게만 해놓고아진짜 스트레스 짜증 아 진짜  욕나온다
1,진짜재미없음 징그럽기만하고 영화끝나고 이걸왜봤나 싶음 재미도없고 감동도없고
1,영화 잘 만들고 재능있으면 다 용서될까요? 여기 출연한 아역이 연기잘했다고 박수쳐 줄 일인가요? 나홍진감독은 그 재능으로 소설쓰세요. 여러 사람에게 상처주지 마시고.
1,곡성을 보고 난 뒤 자꾸 가위를 눌리고 귀신꿈을 꾸네요 저만 그런건지 참 기묘한 영화..
1,네다음 국뽕영화 10자
1,정말 돈 내고 보기 너무 아깝다  시간 지날수록  화가 나는 영화  기분만 상하고 싫다 진짜
1,어이없다는 말이 딱 맞는 영화...왜 이런영화를 만드는지...참...
3,별로임...기대마니햇눈데
4,결국에 범인보여주려고 두시간반을질질끌고온 영화내용없네
1,자극적이기만하고 내용이 없다 징그러운거 더러운가 잔인한거 그리고 너무 시끄러움
1,무섭고 잔인하고 쉴새없는 전개에다 불친절한 결말
1,정말 지루하고 재미없는 영화. 어이없는 결말. 개망작.
1,배우 연기력이 너무 아까운 영화... 개인적으론 어디가 무서운 부분인지 몰라 분석도 해보고 해석도 읽어봤지만 생각할수록 정말 허접스러운 영화임. 개연성도 없고 영상미도 없는 배우의 연기력만 존재한 영화였음. 사람들 ...
1,솔직히 반전에 반전이라니.... 다 헛소리다. 지루하고 허접한 스토리 엄청난 배우들의 연기력 제외하면....ㅉㅉㅉ전문가들 홍보니 빨아대는 꼴하곤....ㅉㅉㅉ
1,지금까지본영화중에 제일 불편하고 손에꼽는 망작이다. 이거 볼바엔 차라리 구타유발자들이 훨씬 명작이지
1,관람객 평가를 보고 봐야했는데... 그냥 미끼를 덥석 물어버렸네요... 정신건강에 해롭고 마음이 삭막해지는 영화...
1,지루했습니다. 무엇을 얘기하고자하는지 잘모르겠네요
1,"스토리, 화면연출, 반전, 결말 어느하나 맘에들지않네요.."
1,진짜보지마라 핵노잼이다
1,전체적인 흐름은 알겠는데 세밀한 개연성이 부족함.  감독이 생각한 틀 안에 억지로 끼워놓은 느낌
1,노잼... 알바들 고생이 많다
1,노감동 노공포 노잼 역겨움
10,올해 최고의 영화 한국영화중 이런 영화가
1,아는 만큼 보이네 어쩌네 하는데 이해를 하고 감독의중 파악하고 다해봐도 영화자체가 재미가 없다 영알못 드립 치지마라 이게 몰입감 최고니 스릴 장난아니라느니 무서워 잠 못자겠다느니 하는 사람들 얼마나 유리멘탈이면 이 ...
1,노답. 그냥 킬링타임용 영화 그 이상 이하도 아니었다
3,노잼 노이해...ㅜ..ㅇ..
10,완전 대대대박 2시간 반동안 지루할틈이 없네여 ㅋㅋㅋ꼭보시고 검색해서 맞춰보세여 ㅋㅋ
1,메세지 알수없음..결론 너무 관객에 떠 넘김...찝찜함.
1,닥치고 기승전결골룸 끝
1,이건 쓰레기같은한국영화 그만좀...
1,존나 지루햇음... 노잼 이거뭐임
1,진짜최악 개연성 1도없는영화
1,제가 태어나서 본 영화중 정말 제일쓰레기였습니다. 꼭스포 읽어보고 보시고 내용쓰기도 귀찮네요. 스릴러인줄알았는데 80년대 전설의고향보는느낌
1,보고나서 좋을게 하나없는 영화
1,진짜 정신건강에 해롭습니다 절대 보지 마세요... 이런 역겹고 잔인한 영화를 어떻게 10점을 주며 볼수있죠? 보고나서 기분더럽고 토할것같았어요 악몽같네요 부탁인데요 이런영화좀 만들지 말아주세요 제발...
1,개노잼....스트레스사옴
1,영화 예산부족해서 만들다가 말았냐? 기승전끝. 편집도 ㅈ같이 해놨는지 스토리가 안이어져. 개망작 하나 추가요.
1,감독에게 개연성 따위는 중요치  않은 모양이다심지어 뜬금없는 좀비씬은 B급 좀비영화같다
1,진심 재미없습니다. 비추합니다.
1,그냥 내 돈 주고 자해하는 느낌
1,정신건강에 무척 안좋은 영화. 이걸 청소년들에게 보게 한 감독은 예술인으로서 책임이 결여되었다 본다.
1,ㅋㅋㅋ 이게 ?? 7점??;;; 그냥 쓰레기 영화개연성 전혀없음. ㅋㅋ;; 일본놈이랑 황정민이랑 싸우는데 결국에는....스포니까 참는다. 아... 진짜 반전이 이해가 되야 반전인데 억지로 반전만들기 ㅋㅋ 진짜 황당하...
1,실망입니다 나홍진감독
1,이게 왜 15세 관람가인지 설명 부탁합니다. 중딩들이 가서 봐도 될 만하다고 생각하세요?
1,여러분꼭보세요 ㅎ진심 핵입니다
1,돈이 아깝다... 정말 잔인하고 더럽다
1,이거 결말이 이해가 왜 안된다는거지? 영화보면서 무서워가지고 눈감고 봤냐?어쨋든 별로임 보지마셈
1,진짜 개알바들 짜증나내 ㅡㅡ 얼마받니 이런쓰레기영화본내잘못이지 평점에낚임
10,'절대 현혹되지 마라' 딱 이 한마디면 충분하다.
10,"나홍진감독의 스타일을 이해못하는 사람들이 많네 추격다, 황해만 봐도 곡성이 새로운 장르에 도전한 걸 알수있을텐데. 스토리전개에 몰입도에 반전에 감탄했습니다. 역시 나감독 스퇄 굳 ㅋ"
10,내용을 이해했다면 소름끼침 영화끝나고 일어나는데 다리가 후들거리더라
10,다보고난후 하나씩 내용을 이해할때마다 소름돋는 영화
1,"좀비 꿈뜰거리는거 지렁이야뭐야~~ 토하는거 물뿌리갠줄,,진짜진짜 고어물 못보는 분들은 무서울것가은데 음..저는 개인적으로 별로여써요"
1,ㅋㅋㅋ알바엄청많나베????ㅋ뭐가한국영화의한획을긋고 머가재밋어ㅡㅡ보는내내 지루해서 허리아퍼두ㅣ지는줄돈아깝고 욕나옴
1,이건아니다.진심아니다
1,정말 개연성도 없고 무슨말을 전하려고 했는지 감독사상이 진짜 쓰레기네요 기분이 너무나쁘고 머리가 너무 아픕니다 진짜 이딴 영화는 보지마세요 정신건강에 안좋습니다
1,재미없어요.  기분만 찜찜해요.
1,나에겐 지루한 영화. 이해하고 자시고 할 것 없이 스토리가 단순하다. 감독이 심어놓았다는 맥거핀들은 어디선가 많이 본 것들. 그냥b급 정서의 영화라고 할 것이지 . 감독은 힘이 다한듯. 스릴러를 만들어달라고!!! 피...
10,너무나 편리한 것에만 익숙해진 요즘 사람들은 영화조차 편하길 원하는듯
1,황정민이  결국에 악역이라니..ㄷㄷ
1,감독의 고민은 인정! 최고의 캐스팅도 인정!허나 정리 안된 시퀀스의 조합이 찝찝함과 납득어려운 조잡장르의 영화를 만들었네요 이게 대체 무슨짓인지....원 시나리오가 궁금함....
1,사람이 죽었다로 시작해서 사람이 죽는걸로 끝나는 영화관객한테 수많은 미끼를 던지는데 뭘 물어야할지 모르겟다
1,관객을 낚는 영화 뭔가 있는듯 하지만 아무것도 없는 앙꼬빵이다 짜샤
1,정말 실말만하고왔습니다. 진짜... 뭐 이런영화가 도대체 어디가 연출이뛰어나고 대단하다는건지 도무지 잘모르겠네요. 제가 영화를 잘몰라서 그런건가요? 전혀 짜임새도 안맞고 잔인한영화좋아하지만 이건아니라고봅니다...
3,영화 전반적인 내용은 괜찮은데..이해가 안가고 짜증이 밀려오는 느낌 좀비도나오고 악마에 귀신에.종교적인것을 짬뽕시킨거..
5,방금 보고 나옴..굳이 볼 이유가 .돈.시간 낭비.감독이 뭘 말하려는지 난 모르겠다
1,아 진짜 보고 왔는데 이렇게 찝찝한 영화는 처음이였습니다. 1점;;
1,반전에반전에반전~ 어거지반전 진심 돈아까움
5,마무리가  참...마무리만 잘했으면..
1,한개도 아깝다.  시나리오 초2수준
10,나홍진만이 만들어낼수 있는 월드유니크무비
1,평점알바는 물럿거라 ㅡㅡ
1,와 알바 장낭 아니다 ㅠ 좀 따뜻하고 보고나면 세상이 아름가워보이는 영화 좀 만들었으면..
10,무섭다라는말밖에...소름돋앗네
10,이건 엄청난 영화임! 심오한 의심 믿음 에 관한....머리가 얼얼하다 진짜 미친영화!
10,모든 배우들의 열연에 지렸습니다....다들 연기하느라 고생많으셨겠어요 강력추천!!!
9,2016 악마를보았다...뭐든지 압도한다
10,"이런 오컬트적인 수작은 다신 못나올듯,,,,진짜 명작입니다"
1,아.빵점이 없어서 1점이다.
1,개연성 전혀 없고 등장인물들의 이해할 수 없는 행동.. 소재가 비현실적이면 캐릭터들도 비현실적이어야하나? 시간 버렸네
1,부산행도  그렇고 곡성 이것도 사이코 사기꾼 색퀴가 싸지른 똥이네 ㅉㅉㅉ  사기꾼한테 돈 갖다바치면서 똥성분이 뭔지 분석하고 자빠진  개돼지들 넘쳐나고 ㅉㅉㅉ 개돼지 선동하는 전문가 개돼지들 니들은 이제 영화공짜로 ...
1,배우들만 혼신의 연기를 한 주옥(잣)같은 영화.. 본 사람들을 무척 불편하게 만드는 대충 만든 졸작.
1,잘나가다 마지막에 가선 얘기가 완전 엉망진창... 억지스런 반전에 황당함만
1,굳이 일본배우까지 섭외해서 악마 역할만 일본인으로 설정할 필요가 있었을까....천박한 반일감정이 존재하는 C급 영화
1,요약: 끄르릉 둥탕둥탕 쾅쾅 고오오 쓱삭 꽥!예술이든 철학이든딱히 의미가 없는 영화...종잡을 수 없는 분류의 영화임호러 매니아로써 코믹요소넣고 좀비 귀신 기독교 무당 다나옴 이 시간에 새벽에 저주 다시보기 하는게 ...
1,"1점도 아깝다. 감독, 영화사, 평론가 3위일체로 만들어낸 관객우롱 영화다. 조금 전에 보고 집에 도착했는데 울화가 치밀어서 잠을 잘수가 없다. 내 주변에서 곡성 재미있다고 한놈들 곡소리 나도록 줘처맞을 준비해라.내..."
1,이딴것도영화라고  집어치어  무슨감독이지멋데로쳐만들었어
1,일본악귀가 결국 곡성사람들 다 죽인다는건가? 뭐하나 제대로된 결말이 읍네 ㅡㅡ이거 심야로 본다고 나간 시간이 아깝다잠이라도 더 잘껄..
