1,이딴식으로 영화만들면 OO다.. 무슨 들리지도않는사투에.. 그냥해도 되는대사를 개그쳐서 억지개그에.. OO 무슨 스토리전개가.. 스릴러면 스릴러대로나갈거지 뭔 코미디를 곳곳에넣어놨어? 글고 15새관람가에 성관계가왜나...
1,도대체 얘기하고자 하는게 뭔지. .  지루하고 재미없어 시간만 봤음.  돈이아깝다.  좀비영화인지 귀신영화인지 . . 소문에 낚여 본 내가 어리석다고 느꼈네요.
1,비추비츠비추비추비추비추비추
1,내용이다소  어려움 한번봐서이해못함
1,온 나라를 귀신소굴로 만들려고 하나..그리고 이걸 마치 기독교영화인것처럼 홍보하는 건 뭐냐~ 영화찍으면서 옆에서 굿판 벌였다면서... 진짜 기독교인들은 이런 영화 안만든다!
1,정말 너무 재미 없어 내용 너무 짜집기
1,먼영환지모름....
1,????그냥 영화내내 소리만 시끄럽게해서 귀만 아프게하고 도저히 이해도 안되고
1,이영화에 별다섯개 주고 극찬하는 알바들은 몸팔아서 돈버는 OO와 같다 ....영화보다가 짜증나서 그냥 나와버림(진실)  필름이 아깝고 감독잘못만난 배우들이 개고생했을듯 ...
1,스토리도 허술하고 어이없고작품성 꽝뭣이 중헌지도 모름서(표값아까울정도)
1,이런것도 영화냐  어디를 봐서 시나리오의 연계성이 있냐앞뒤를 맞 추는건 작가뿐이냐
1,"두번보니까 알겠어요. 감독이 스릴러를, 훼이크장면을 얼마나 많이 갖다붙였는지. 진짜 영화의 절반이상이 불필요한장면이에요."
1,노잼핵노잼시간낭비이거볼빠엔다른거봄
1,돈아깝고 시간아깝다.
1,정말 별로였던영화 ㅇㅇㅋ
1,반개도 아까운..훌륭한 배우들로 감독은 무얼 하신건지...평론가들 제발...자존심들은 지킵시다..
1,진짜 너무 재미없고 황당하다
1,개연성이고 복선이고 아무것도 생각지말고 흥미위주로 봐야할 영화 아무런 의미도 두지말고 철학적생각도 하지말고 봐야할 영화 초중반에 복선인듯 깔아놓는 장면들이 후반부에 들어서 허무함을 안겨줌 그야말로 초흥미위주영화 영화...
1,내가 이런거 안남기는데 나홍진?진짜 앞으로 영화만들지마라 이러니까 한국영화가 욕먹는거야 저예산에 언론플레이는 ㅈㄴ게한 영화 진심쓰레기 보지마 차라리 집에서 치킨시켜먹어라 ㅡㅡ
1,내평점 이런게 어떻게 15세인지...정신건강에 진짜 안좋은 영화감독 마귀쓰인듯..정신감정 받아보시길..토나온다 특히 청소년분들 절대 보지마세요!!
1,최악의 영화...그냥 영화를 이슈화시켜서 돈벌라고 만들었나?ㅋ 영화가 대중하고 소통을을 하고 공감이 가야지 이건 뭐 그냥 감독 혼자 만족한 영화...보는 내낸 불편했음 런닝타임 오지게 길고....ㅋ그냥  결말 되게 ...
1,"해석할거리가 많은 영화인건가 설정자체가 없다시피한 영화인건가?? ""신도 포기한 악마를 보여주고싶었어요""라고 한다면 차라리 이해하겠는데 감독의 입에서 나온 얘기를 듣다보면 이건뭐지 의심하게만드는 영화....."
1,최악의 영화..전혀 공감안되는 캐릭터들의 행동과 개연성없는 억지 전개에 실소만 터짐...러닝타임은 쓸데없이 길기만 하고 심오한 철학이 담긴 것마냥 포장하지만 들여다보면 그냥  똥..감독이 능력이 안되면 영화가 어떻게...
1,예수와 악마가 있다는걸 이렇게 잔인하게 표현할수도 있군요. 도데체 제정신인지
1,뭔 잡영화야 개밥보다 더 잡스럽네
1,이런 십장홍진....
1,자신의 정리정돈되지않은 혼잡한 스토리를  화려한 영상으로 치장한 영화
1,뭔내용인지...이상하다...
1,개노답영화 이감족영화다신안봄
1,중간에 좀비가 나온 이유는 먼가요? 감독 양반 솔직히 말해라. 당신 경찰 졸라 싫어하지?
1,배우들은 다 좋고 연기도 잘하는데 영화가 무슨 내용 인지잘...
1,돈과 시간이 아깝습니다
1,아~~ 할말 없게 만드는 영화.... 황정민볼려고 왔다가  남친이랑 싸우게 생겼다. 뭐 내용도 없고 그지같은 영화.  아~ 오늘밤 꿈에 나올까 두렵다. 윽...
1,그냥 처음부터 끝까지 재미도 없고 감동도 없고 의미도 없고 왜 1위인지 모르겠는 영화
1,영화 러닝타임이 길어서 초중반엔 나름 스릴있었는데 가면갈수록 지루함이 느껴짐. 곽도원 연기 매우 잘한다는거 빼고는 남는게 없는 영화. 다른 연기자들은 so so. 프랑스에서 기립박수 받았다는 기사보고 간건데 진짜 양...
1,왜 만들다 만 영화를 돈주고 봤는지 아 아깝다 내돈
1,보면기분찝찝했음. 이거본날 악몽꾼사람여럿봄 ㅋㅋㅋ
1,여기서 좀비는 쫌...
1,아...이런거 보고 살인하고 사람죽이라는 거구나....15세믄 중딩고딩들 보고 좋은 자극되것네멋져멋져
1,근래에 본 최악의 영화. 보다가 헛웃음 지은 내 인생 최초의 영화
1,뭐가 재밌다는 건지?연기력 때문에 보는 건가? 이 영화에서 이야기 하려고 하는게 뭔지?이런 영화를 왜 만들었지?1점도 아까움
1,내인생 최악의 영화  돈이아까워  처음으로 영화에 리뷰남기게하는 영화
1,존나기분나쁜 영화.기분나쁘다는 표현으론 부족함. 친구랑 보러갔었는데 영화 끝나자마자 뭐 OO 어쩌라고 소리 절로 나왔음.진짜 어쩌란건지 모르겠음해석봐도 수호신 어쩌고하는데 그럼 첨에 뭐 복선이라도 깔아두던가 무턱대고...
1,그대가 기독교인이라면 보지마라그대가 미성년자라면 보지마라그대가 영화를 보고 싶다면 보지마라돈과 시간이 많다면 보아라.
1,명품배우들모셔놓고 뭐하는건지...평점이 7점대8점대인게 이해가안가네요..
1,그래서 황정민이랑 그 외지인 악마랑 곡성에서 사람죽이는 이유가 뭔데?사진찍는 이유는?좀비는 왜만듬?경찰 두명도 답답...사진모아놓은방을 찾았으면 핸폰으로 사진찍어서 증거남기고 잡아가야지 걍냅두고 내려옴..결말도 엉성...
1,별 1개도 주기 아깝다.. 연기 잘하는 배우들  데리고... 이게 머니;;;보고나서 기분 찝찝하고 왜 흥행하고 잇는지 모르겟는 영화다...정신건강상 안보는게 옳다고 말하고 싶다
1,지금 보고왔는데 어이없는 내용 스토리가 뭔지도 알수없는 수레기영화  내돈내놔!!!
1,"결말은 각자 해석하시면 될 것 같고, 개인적으로 한가지 확실하게 느낀건 사람들 정신과 영혼에 결코 좋지 않은 영화라는거.. 청소년 관람가라는 사실을 나중에 알고 경악했음."
1,그래 ㅠㅠ 평점이 너무 높았어..한 7.5가 적당..8까지도 아님 첨개봉할때 너무 기대해서 본거지.. 배우들 연기력은 정말 최고 근데 보고나면 뭔가 찝찝하고 찌뿌둥한느낌..
1,"영화보고 지금까지 한번도 평점남긴적없는데..이건남겨야할것같아서 이렇게 글씁니다. 지금까지 살면서 봤던 영화중 최악입니다. 제가 오컬트나 엑소시즘 장르를 잘모르지만, 서사나 캐릭터에 전혀 몰입이안됩니다. 중간에 좀비나..."
1,무슨내용인지결말이 너무허무하네요...
1,개연성 없는 좀비물..영화끝나고 해석찾아보는데만 영화보다 오래걸린다
1,중간에 의미없는 ㅋㅅ 장면이나... 복선 회수도 제대로 못하고 덜만든 영화란 느낌이 물씬. 우리나라 관객이 애국심에 영화를 좋게 보는건가 싶은 수준임. 돈주고 본게 아깝다. 앞으로 이 감독은 걸러야겠다.
1,호불호가 갈리는 영화라지만 저와는 맞지 않더군요
1,너무무거운영화였다 초반엔 긴장감을 주다가 뒤로갈수록 나가고싶은느낌 지루한데다 보기꺼려질정도로 끔찍한영화...이영화를 다보고 나서 느낀 교훈은 여자말을잘듣자 ㅋ
1,그럴듯한 인도 카레 요리를 만드려고 온갖 재료를 다 준비해놓고 완성품은 오뚜기 3분카레 매운맛..
1,재미없었음 시간낭비한듯함 포인트로봤는데포인트아까움ㅜㅜ
1,쓰레기중에 쓰레기 시간은 3시간이야
1,무섭지도 않고 지루하다.
1,검은별 4개 반 드립니다.
1,"뻔한 클리셰 덩어리, 개연성은 어디에?"
5,꿈보다 해몽인 영화....
2,배우들의 명품연기에 비해 스토리 설득력이 현저히 떨어진다  관객에게 질문을 던지려 하였으나 그것도 앞뒤 개연성이  없어서 아쉽다
1,짬뽕에다가 그럴듯한 양념을 뿌렸지만 보고 난 관객들은  모두가 나와 말하더라  '먼 소리지?'  감동하거나  진짜  궁금한게  있는게 아닌 영혼없는 잡탕을 맛보고 하는 짜증난 소리 뿐
5,"첨엔 잼있다가 중간부터 좀비로 바뀌고 후반 그냥 그럼,,,누가 범인인가에만 촛점이 맞춰지고 귀신이 어떻게 됐는지에 대한것도 안나오고,,, 그냥 퀴즈 영화임,,,비추,,,"
3,"배우연기(그 중 일본인),다른 한국공포영화는 다르게 범인 알려주엇지만 그걸 헷갈리게 하는 영화,하지만 문제점은 너무 낮은 개연성, 떡밥이 떡밥이 아님, 설명이 필요한 부분에서는 주인공 때문에 막히고, 그리고 열린결말..."
1,오랜만이다 끝나고서 이렇게 불쾌하고 찜찜한기분을 선사한 영화는
1,소문난 잔치에 먹을 것 없다
1,이걸 영화라고 만들었나?시간낭비하고 돈 낭비하고~
1,"공짜로 보는것도 시간이 아까울정도,,,OOO기,,,"
1,이게 왜 15세인지 이해가 안감
1,언제 개봉했는지도 모르고 누구 나오는지도 모르는데 범인은 안다 ㅋㅋ
1,존나재미없다그냥ㅅㅂ
1,이유없는스토리에.. 진짜 너무 거품이 심한 영화네요 끝나고 나서 관객들 허탈한 웃음이 가득했습니다 개봉일이 지날수록 평점이 자꾸 떨어지는 이유를 알겠군요
1,후...진짜 화가 난다 영화가 끝나고 여기저기서 한숨이...
1,안보기를 강력하게 추천
1,황정민이  아깝다    일찍내려야할듯  국민정서에도  악영양  이다  영화보고  이렇게  기분찜찜하긴  첨이다
1,과장만 넘친 영화. 안 하니만 못한 설정들. 이런게 최고라니 웃음만
1,진짜 답답해 죽는줄알았음 길기도 길고 ㅡㅡ질질끌면서 전개 느린거 싹 질색. 그리고 뭐 소리만 졸ㄹㄹ라 지르고 배우들 . 그나마 황정민 연기만 볼만했음
1,영화 보고 나오는데...사람들이 욕하는 소리...어이없고 불쾌하고 스트레스만 받는 영화였다.스토리도 없고 임팩트도 없었음.
1,홍길동 2번 볼껄.  이런걸 수준 높은거라 생각하는 바보영화 바보평론가  아니 돈먹은 평론글 ㅋ
1,뭐지 뭐지  뭐래??? 하는 영화
1,별 하나도없다 이영화는 제일 쓰레기영화다.돈아깝다 진짜2시간반동안 만들어놓고 낚이네?스릴넘치다고 댓글단사람들돈얼마받고 알바하는거?
1,너무 기대를 했나.. 스토리 왜 이모양... 앞뒤가 안맞어...
1,이것 저것 잡탕처럼 섞어 만든 쓰레기
1,영혼에 안좋은 영화..
1,별반개도 안주는거 만드세요 네이버
1,이게 영화면 뽀르노는 예술이 맞다.
1,개인적으로 너무 바보같다는 생각만드네요 .답답하다못해 졸뻔했어요. 영화 자주보는데 개인적으론 답답했습니다.
1,????뭐냐 ?얘기하고자하는게모냐
1,보는내내 감독 멱살잡고 싶게하는 영화
1,평점 처음남겨본다. 1점도아까워
1,첫장면 - 외부인이 낚시바늘에 미끼끼움그때 알았어야 했는데..
1,관객에게 겁나 미끼잘던진 영화꼭보세요ㅎㅎ
1,진짜 시간아깝다 보다가 나가고싶은영화였다
1,한국에 아직 이런 영화를 만드는 사람이 있다니..
1,100억이나 들여서 스토리는 묘연하고 비명만이 있구나게다가 15세라니 감독이름에 심의잣대도 포함되는듯
1,이해안감 왜기다린거지 좀비임그냥 19세로 올려야할듯
5,보는내내 두통과 매슥거림에 시달렸다나홍진 감독의 결말은 꼭 비극이고 앞 전 상황을다시한 번 생각하게 만든다
1,조만간 본 사람들이 보지 말라며 입소문 낼 거 같다 ㅠ 너무 잔인하고 무섭워서 밤에 잠도 못 자고 청소년들은 절대로 보면 안 될 영화
1,참....우리나라 영화
1,결말을 좀 내주십시오..내용이 뒤죽박죽입니다. 왠만한 영화 불편불만없이 보는데 하..답답합니다ㅠㅠ
3,"알바들 좀 지능적으로 썻네. 영화가 무서워서 보지말라는둥, 영화 평하라니까 황정민 무당하라는둥 어그로 한번 지데로 끄네. 솔직히 이 영화 난 제미없게봤다. 무섭지 않고 중반에 살짝 웃기기도 했고(잘 안죽는 장면). ..."
1,진짜 별 한개도 아깝다.. 살면서 본 영화중에 최악이다
2,이해가 안간다 .감독이 보여주려고 하는바도 모르겟고 보면서 너무많이 놀랏는데 결국 반전에반전에반전판타지도아니고 공포도아니고 스릴러도 아니고 이게 뭔지...
3,배우들의 연기는 정말 흠 잡을 데 없었습니다. 내용적인 면은 좀 난해하군요. 영화보면서 계속 든 생각이 기괴함이었습니다. 또 15세 관람가라고 하기엔 너무 징그러워요. 피범벅인 장면이 많이 나옵니다. 결말 해석을 떠...
3,상업적으로 흥행이 우선이 되다보니 관객들의 이목을 끌만한 소재와 떡밥씬을 엄청 사용했다.그러다 보니 저질영화가 될게 뻔하고 감독의 명예는 또 놓치기 싫은지 그와중에 선과악??철학?같은 되도않는 의미부여를 하려고 시도...
1,정말기대이하  어이가없네요?최악!
5,"신림에서 밤 10.40 실제 관람후기.곽도원의 기막힌 연기력은 정말 말로 표현이 안된다. 하지만 내용이 난해하고 중반부 부터 산으로 향함. 또 반전의 반전을 거듭하지만, 보고나서 찝찝하고 감독의 의도를 도통 모르겠고..."
5,곡성울리게 만들었다 참
1,방금 영화 끝나고 나왔는데...초 중반 재밌었습니다...클라이막스도  고조감 최고였습니다...그런데..결말이 없네요...뭐죠?관객이 보고 혼자 생각하라고 하시는건가요?왠지 기승전결에서 결이 빠진  영화같습니다..개인...
3,진짜 현혹되지마라ㅋㅋㅋ
10,이거보고 잔인하고 징그럽다고 징징거리는 새끼들은 뭔생각으로 영화본거냐 공포영환데 그정도는 감수해야지  징징거릴거면 12세나 전체이용가 영화보던가
10,신파함께나 좋다고 쳐보는 한국관객수준 아니랄까봐 똥을 뿌리고 가네. 니네 어깨 위에는 장식이냐? 너희랑 같은 1표라는게 믿기질 않아. 니네가 조선시대 깡촌 무지렁이 농부들하고 다를게 뭐야?
10,곡성을 넘는영화 아직못봤음
10,평점 1점남긴사람들은 뭐 영화평론가납셨네사상이쓰레기인건지 생각이 삐뚤어진건지재밌기만하구만 돈이아깝니어쩌니 찌질대네그나저나 곽도원 발암이네진짜
1,스토리도 없고 결말도 없고 이게 왜 별점이 높은 건지...
1,떡밥이니 미끼니 아무거나 막뿌려놓고 끝나버리는영화. 미끼를 물었으면 그러려니할텐데 끝나고도 헛웃음만 나올뿐. 모든 소스를 섞어서 완성된 까르보나라해장국. 종교적인 요소도 엉성할뿐더러.. 모든장르 하나씩 맛보기로 넣은...
1,"해석을 떠나, 재미가 없어요"
1,천우희 이쁜걸로 156분 참음
1,도대체 무슨 반전이라는거야...그냥 한국의 어두운 그렇고 그런 스토리에 결말에..중간에 좀비는 모냐.. 당최 이해가 안된다..멀 이렇게 짜집기 해놓은거야..
1,이영화는 100% 국산품 좀비영화판
1,차라리 이거 볼 시간에 똥을 싸겠다.내 26년 인생 최악의 영화.
1,보는 사람마다 평이 다른 영화. 관객들의 여러 해석은 재밌으나 중반 이후 지나고서는 보는 내내 불편했던 건 인정할 수 밖에 없네요. 현실적인 스토리로도 충분히 메세지까지 전달했을 것 같은데 아쉬웠습니다.
1,내가 본 영화 중 최악의 영화 중 하나...나홍진이 천재라고?ㅎㅎ^^;;;
1,이 영화가 얼마나 과대포장 되어있는지 알려야 한다는 사명감으로 글을 남깁니다. 허술한 내용을 뭔가 있어보이게 꾸미려고 떡밥을 마구 던져놓았지만 그 저의가 금새 간파될 정도로 질이 낮아요. 이런 3류영화가 화제거리라니...
1,너무 별로임 내용이 먼가 싶기도 하고 그냥 돈벌려고 한 동영상
1,재미도 없고 유명해서 봤는데 진짜 3류 영화
1,말도 안되는 상황 부여... 그리고 어떻게든 위대한 반전을 뽑아내려는 안간힘....
1,"하 진짜 이감독 이름 외웠다 다신안보게. 뭐이리 질질끌어 반전같지도않은 반전 보여줄라고? 소리만 빽빽 질러대는 영화고 15세 영화란게 신기하고 보는내내 욕나온다 배우진과 평점에 낚여서 돈,시간낭비하고왔다 c발"
1,쓰레기??결론부터 예기하자면 한국귀신 영적존재에 대해 예기하는거 같은데?초반부 나름 집중해서보다 ?왠 뜬금없이 좀비가 나오질 안나 악마가 나오질안나?동서양꺼 조잡하게 카피삽입해논거같음?한마디로 짱나는 영화임?뭘 예기...
1,0점이 없어서 1점을 주다니..ㅠ정말 근자 보기드물게 엉터리영화!!중간에 좀비는 뭐니...?ㅠ환장혀..우째야쓰까..느작없는거..!!
1,감독전번까라 이렇게 영화불친절하게 만들엇음충분히질문에 대답해줄 의무잇음ㅡㅡ  받기싫음 돈환불해주던가ㅅㅂ
1,정신적으로 너무 안좋고...너무 잔인하고 무섭다...너무 끔찍하고...심장 약한 사람들한테는 너무 안좋은거 같다..좀비보다 더 무시무시한걸 보는듯 햇다...자는 내내 꿈에 나와서 괴롭혓네....
1,한국영화 볼 수록 한국은 영화를 못 만든다
1,다신안볼영화 너무 징그러움
1,영화관에서 잠깐 졸았을 정도로 몰입이 잘 되지않았던 영화호불호가 갈린다지만 나에겐 확실히 불호였다.
1,살다살다 이렇게 황당하게 끝을 안맺고 그냥 끝나는영화는첨이네..결말이 머임?그렇다고 재밌는것도아니고..정말 자다나왔다 ㅉㅉ
1,답답하고 짜증나는 스토리라고 생각합니다. 보는 내내 아무 뜻 없는 이야기에 화만나네요. 안보시길 추천합니다.
1,찝찝해여 저도 평점 내려야겟어서 남깁니다 뭔지모르겟어서 해설찾아보게만들고 그래도 안풀리는게 너무많아요
1,적당히해라!반전있는오컬트무비에열광한다고다들있어보이진않는다!
1,2시간 반동안 지속적으로 주는 긴장감 공포외에는 아무것도없는 영화
1,방금 롯데시네마 수락산관에서 보고옴. 도대체 왜 언론에서 영화를 보게끔 유도하는 걸까? 누구를 위한 걸까? 다시는 이 감독 영화 안본다.  돈 벌이 하는 재주가 가이 우수하다. 모가 좋다고 이따위 것을 영화라고 돈을...
1,개연성이라곤 1도 찾아보기 힘든영화. 뭔가 꼬고 꼬려고 했으나 갑자기 귀신튀어나오고 갑자기 좀비물되고 갑자기 독버섯 미끼 던지고. 벼락은 왜 맞아 화상 입으며 왜 일본인은 천우희에게 쫓기는지 굉장히 불친절한 영화.
1,황해 때도 그랬지만 나홍진 감독 영화는 분위기 배경 톤 모두모두 더럽다. 헌데 이번엔 내용까지 더럽다. 앞으로는 나홍진 감독의 영화는 패스
1,"솔직히 3류소설 내용 아닌가요? 차라리 과학적 근거에 맞게 어떤 바이러스에 의한 사건이라고 하는게 나을듯. 해석 보고야 알았지만 개도 안믿을 토테미즘이니 무슨 귀신, 좀비 어휴;;;; 보는 내내 자극적인 장면에 비위..."
1,"시작은 미약하나 끝은 어이없다.시작10분까지 스릴만땅이였다.하지만 가면갈수록 좀비,골름,귀신, 그래도  꾹 참고 반전이 있겠구나 생각했지만..말도안되는 개연성과 반전없는 반전으로 의미 없이 끝난영화 귀찮아서 댓글 못..."
1,재밌다는 말에 절대 현혹되지 말라
1,노잼 진짜 무슨 대머리 계속 살아나 죽엇는데
1,"너무높은거같아서 1점드려요....개연성없ㄴ,ㄴ.."
1,"최악의 영화, 감독이 의심으로 인해 당한 충격적인 사건을 경험한 듯. 의심을 종교코드에까지 연결시켜 가족을 위하는 순수한 마음도 무참히 짓밟은... 인간에겐 희망이 없음을 말하는 영화. 그런데 감독은 돈을 버네. 이..."
1,소소 기대없이보시길 불호..
1,역대최악임 이걸영화라고!나홍진씨 실망임다프리퀄영화 같은데인트로를 요즘은 영화라고 상영하나봐요!
1,1도 아깝고 돈도 아깝고 시간도 아깝네
1,뭘 얘기하려는건지.. 주말저녁  돈버리고 시간버리고 혼란스런 정신.. 이건 정말 최악이다!!!
1,추격자와 황해 스타일로 연출해 주시길...
1,뿌려놓은 떡밥회수가 빈약하지 않았나.. 오락성은 있지만 안봐도 무방한영화
1,돈 아깝고 관객 우롱하는 어설픈 영화! 해석 어쩌고 저쩌고  짜맞추려는 한심한 알바들!
1,난 정말 재미없던데 ㅋㅋ
1,15세이상관람가치고는 너무 잔인했음
1,쓰레기라 들었습니다 ㅋ
1,1점주기도 아까운영화임
1,1점도 아깝다. 그냥 개같은 영화~!!!!
1,무섭다기보다 끔찍한 영화네요... 어느정도 미끼를 던져 관객들을 현혹한 점은 뛰어난 감독이라고 인정할만하지만 너무 충격적입니다. 효진이 역을 연기한 저 어린 소녀는 어떻게 영화를 촬영했을지 참 궁금하네요...
1,다 쳐 알바냐? 장난하나
1,기법기교 다 좋다 반전에 반전 좋아 그래서 말하고자 하는게 뭔지.악마가 성경구절을 읽고 소름끼침.인간이 쉽게 현혹되는 불쌍한 존재라는거임?진짜 악마가 만든 영화를 보고나온느낌 스릴만 넘치면 철학이 그지 같아도 평점이...
1,하..진짜할말이없다. ㄹㅇ비추
1,"호러물의 여러 장르를 혼합하여 기획하고  제작하신 점, 실험적인 측면에서는  최고였습니다."
1,보면 짜증납니다.  일단 영화 메세지 1. 건강에 좋다고 산에서 아무거나 주워먹지 말자 2. 시킨다고 다 하지 말자 3. 보인다고 다 믿지 말자 끝 글고 보면 진짜 짜증남
1,"기대도많이하고,황정민나온다해서 보러갔습니다평가가 좋은것만 보고갔습죠결과는 뭐지? 엔딩크레딧올라갈때 사람들 안일어나는거보면저와같은생각이었을지모릅니다일단 현실감 제로~ 개연성은 찾아볼수없음마치 1탄시리즈 이후로 2탄을 ..."
1,시간아깝다 내용이 난잡하다
1,내 최근 15년 관람영화중에 젤 쓰래기. 아무리 개취라지만 아는사람이 본다고하면 쌍수들며 말리는중입니다.
1,너무 긴장하고 봤는지 생각보다 안 무서웠지만 기분 나쁜 영화
1,원래  로그인 잘 안하는데
1,내 시간 돌리도이런 예엠..ㅂ
1,보고있는데 기분 더러워지는 영화임 곡성평점테러 탐정 알바생이냐고 하는 평점에 속아 이거 봤는데  그래도 탐정보고 기분 나빠지진 않자나ㅜㅜ 무섭고 징그러운거 나와도 돼는데 뭐 스토리가 없는데 관객이 언제까지 참고 봐줘...
1,정신건강에 해롭습니다. 쏘우 이상의 고어에 공포영화인데 어떻게 청불이 아닌지 묻고싶네요
1,시간 아깝고 돈 아깝고..
1,하.... 내용연계성떨어져..
1,"광고보고 일요일 관람결과 정말 이건 아니다라는 느낌.내용도  전달하고자 하는것도 구성도, 옆좌석 부부도 실망한 말투를 남기고 20분만에 퇴장. 정말 권하고 싶지 않은 영화. 일류배우들을 어쩜 그렇게밖에 활용 못하는지..."
1,1점도 아까움.... 이해가 안됌 징그럽기만하고 스릴도 없음 ㅡㅡ
1,30평생 살면서 내인생 최악의 영화...저처럼 추격자나 황해를 상상하며 이영화를 선택하신다면.. 잘못된 선택입니다.
1,내가 평론가들이 좋아하는 영화를 싫어하는 이유가 있다. 그들은 대중적 재미에 권태를 느끼고 좀 더 복잡한것 좀 더 새로운 자극에 목말라 한다. 그러나 돈과 시간을 써서 극장을 찾는 관객들은 좀 더 명확한것을 원한다....
1,아 너무 웃겻다 .. 하하히하히호호
1,스토리 반전 몰입도 등등의 호평은 솔직히 알바라는 생각이 든다. 돈주고 본 영화 중에 최악솔직히 출연한 배우들이 아깝다.황정민 곽도원 감이 많이 떨어졌네 이런 영화에 출연하는거 보면이게 영화면 뽀르노도 예술이다.
1,반전과 떡밥에 집착한 좀비물?
1,내가 한국영화를 싫어하는 이유를 너무나 잘 표현해줬네 퉤 다신 안본다 어디서 그럴듯한것만 짜집기해서 기승전개병맛 이걸 좋다고 평점주는놈들이나 ㅉㅉㅉ
