6,리얼하긴 엄청 리얼함. 좀비빼고 ㅋㅋㅋ 좀비 뺐으면 좋았을텐데.. 그리고 논리적으로 말이 안 되는 억지스런 개연성을 추구한게 뭥미 나 화장실 다녀왔나..? 아닌데 계속 집중했는데??? 이렇게 느껴질정도로 뭔가 흐름이...
4,극중후반까지는 재미잇었음황정민의등장 3명의범인 근데 반전의반전이 말도안되고 천우희가결국뭔지 설명도 제대로 안하고 떡밥만뿌리고 낚임 내용이갈수록짬뽕이되면서  장르가 다 섞이곸ㅋㅋㅋㅋ이것저것 다 가져다 붙이고 뒤로갈수록...
5,장르불문영화 내가 뭘 보고 온지 모르겠다. 마지막에 화면 꺼지고 다른 장면이 나올 줄 알았는데 그대로 끝. 관람객들 모두 어리둥절하고 어이없어했다. 한 줄 평: 괜히 봤다!!
6,도대체 버섯은 뭐야??ㅜㅜ
8,한국판 좀비+데블스 애드버킷+엑소시스트.VOD 나오면 다시 한번 봐야겠어요!부담없이 보면 힘든 영화입니다.부담 가지고 보시길!
6,역시나 이번에도 내 취향은 아니었고 만약 무명역이 없었다면 서구중심주의적 사고로 샤머니즘과 애니미즘에 대해 엄청나게 모욕적인 영화가 됐을 것.
7,난 영알못임. 이해못하겠음. 내머릿속엔 커플팬티. 아니 기저귀인가. 감독판나오면 다시봐야겠다.
1,그냥 기분 더럽게 만드는 영화 이상도 이하도 아닌듯. 누가 선이고 악인지 헷갈리게 연출해놓고 맞춰보라하면 뭐라 해야되나.애초에 추리자체가 거의 불가능하게 만들어서 재미없는 문제를 푸는 느낌이었음
10,"티비에서 해주길래 오랜만에 다시 봤음. 호불호가 크게 갈리는 영화지만, 난 극호... 한국 영화계 거장의 명맥을 이을 유일한 희망이 나홍진 감독님이라 믿어 의심치 않는다!"
10,한국형 엑소시즘은 분명 매력이 있음.무서운영화를 무섭게만들었으니 최고임
10,영화를 몰입하다 보고 있는 중간 중간에 산 전체가 나오는 장면들이 있는데처음으로 산이 그렇게 소름돋게 보이는 건 처음이였음
10,두번봐도 지루하지않은대단해요
10,소-오-름 멘탈 나갔던 영화 / 나감독 능력은 있는데 인성은 참 별로... 사람답게 살아야 다음 작품도 있는거라는 걸 알았으면.
10,미스테리한 몰입도 최강...ㅎㄷㄷ
10,한번은 그냥 보고 두번째는 장면장면이 주는 의미 검색해서 다시 보면 왜 대박 영화인지 알 수 있습니다.
9,결말이 찝찝하네 뭐네 할거면 영화보지마라 영화를 물로보나
10,알고보면 역대급 전설의 고향
10,사바하보고나서 평점 올려주러왔습니다. .따라올영화가없네. .아직도. . .
10,진짜 볼수록 새로운 영화가 곡성임 ... 한국서 이정도 영화 나오기 어려움
10,해석을 잘 해보면 소름끼치도록 무서운 영화
9,한국에서밖에 나올 수 없는 도발적인 오컬트 대작. 선과 악에 대한 이야기 보다는 불행을 겪는 인간의 혼돈과 무기력함에 대하여
8,몰입도 하나는 ㅆㅅㅌㅊ인 영화. 150분 내내 지루할 틈이 없었다.
10,현실과 너무 잘 맞아떨어지는데 감독이 천재인가?  감독의 속마음을 영원히 알 수 없겠지...
10,이건 진짜 대박이다 스토리 구성 짱
10,황정민님 연기는 ㄹㅇ이다...
10,주변에 종교인들이 재미있게 봐 놓고는 결말때문에 이 영화는 안 좋은 영화라고 말하고 사람들에게 자신들의 종교적 가치관을 강요한다 영화는 영화로서 평가해야한다
10,영화 잘 만들었다 그리고 나홍진 영화 좀 팍팍 찍어라
9,한국 공포영화중 탑오브탑
10,도대체 평점란에 스포하는사람들 왜그런걸까
10,공포영화중 최고의작품 연기 작품성 재미 공포 모두 가졌다
10,집에서 봐도 심장쫄깃하네요잔상이 많이남는 영화!
10,심오하고복잡하지만 난 이런게좋다.
10,한달동안 무서움에 떨게한 최고영화
9,추천하지만 잔인해서 다시 보긴 싫은 영화
10,"장화홍련, 알포인트 이후로 연출 하나로 공포감 쪼는 영화인듯"
10,호불호 갈리는건 이해가는데 갓작임은 틀림없음
10,미끼에걸려 내가 이해한 게 맞나 리뷰들을 찾아보게되고 리뷰를보면서 영화를보며 지나쳤던장면들의 의미에 소름돋는 영화
10,개봉당시 여친이 보자해서 보기싫은영화 억지로 봤던건데.... 이건뭐 곡성이후 곡성만한 영화를 본적이 없을정도이다이영화 정말 잘 만들었다
10,적어도 내게 나홍진은 충무로의 보석같은 존재다
10,정말 괜찮은 작품. 나홍진 감독 다음편도 기대합니다.
10,등돌렸던 한국영화였는데 곡성보고 반성합니다. 정말 훌륭하네요. 특히 중간 굿판은 역대급 전무후무하네요 정말 굿 판보며 숨소리 죽이긴 처음입니다. 아무기대없이 봤다 감탄했습니다. 한국판 스릴러를 글로벌급으로 올려논 수...
10,"그 일이... 그 일이 실제로 일어났습니다. 외지인 무당 일본인(최태민, 최순실)이 흑주술을 이용해서 무지한 주민들(박근혜, 우좀노인네들)을 빙의시켜 혼을 빼앗고 끔찍한 일들을 일으킴(국정개입, 이권, 비리 등) 2..."
1,이걸 보느니 B급 야한 영화나 보는 게 낫겠다. 보는 내내 짜증만 났던 영화.
1,뭐가 이 따위냐 진짜... 이거 너무하는거 아니냐
1,와 리얼 똥 나올까말까 하다가 막힌느낌
1,최악이다....정말
3,감독님 비밀일기는 혼자쓰세요. 속임수를 쓰려거든 나중에 무릎 탁 칠수 있게 개연성 있게 치시든지
1,아오진짜 시간아깝고 돈아깝고
1,존나 또라이! 차라리 B급 좀비영화가 더 나을 듯... 저걸 영화라구 OO도...
1,연기는 박수를쳐주고싶으나 이런영화를 왜만드는지이해가안감...절레절레
1,평점 넘 높음 이게 뭔...
1,별로재미없던데...
1,허허허 머지 .. 그냥 귀신들려서.. 죽임.. 끝...
3,"인과관계도 안맞고 의문이 풀리지 않은, 말이 안되는 부분에 대한 해석도 하지 않은채 짜집어서 던져놓은영화. 결말은 관람객들이 엮어만들고  말이좋아 열린결말이지"
1,별 하나도 아까운 폐륜 영화짬뽕처럼 이것저것 모여서 똥국같은 맛 영화다일요일 내 시간 돌리도아주 실망이다
1,애가 항상 혼자 잠든다..그러니 악마에 씌울 수 밖에..보는 내내 답답함
1,"감독과 알바, 배우, 기자,평론가들은 낚시를 한 것이고, 000은 그것을 물어버린 것이여…..천우희 : 가지마..황정민 : 절대로 현혹되지 마소… 빨리 극장으로 가란께…짱뽕이네? 어디서 시켰어?효진 : 야!!! 이 ..."
1,돈아깝다!최악중에최악!이영화보고 고상한척 종교적으로 접근하는 인간들...보지마라하면 더 보고싶은 맘 드는게 인간이니돈주고 보고 함께 욕이나하세요~!ㅎㅎ
1,영화 중반부터 쓸데없이 베베 꼬아놓은 암시랍시고 미화하는 장면들이 아쉽네요. 그 결과 '결말' 뿐만 아니라 영화 전체 스토리가 유치해지고 말았습니다.
1,최악의 영화.알바들 ㅅㅋㄷ
1,풋~~~ 같잖다. 어떤 의미로 이 영화가 잘 된 영화란 것인가?연기자들의 연기?  ㅋㅋㅋ 이제 나홍진 이라는 이름 기억하겠다. 되도 않은
1,이런 노잼 영화에 평점 높게주는 놈들 특징 : 진짜 재미없고 뭔 뜻인지 모르지겠만 아는척하면 뭔가 좀 우월해 보여서 갖가지 말 갖다 붙이고 높은 평정 매김.
1,황정민 때문에 믿고 봣는데 시간만 날렷다 스토리도 ㅂㅅ
1,좀비....무서운 영화는 아니였다...
1,"정말 OOO 영화 마케팅만 성공, 이게 영화냐??일일드라마가 더 낫다. OO"
1,이거 재미있다는 놈들 전라도밖에 없을듯 뭔소린지 알아들을수도없고 사람말소리 개작음
1,개똥같은 영화! 꼭 감독의 이름을 기억해서 보지말아야겠다고 생각한 영화! 이 영화를 본것과 같은 기분을 느끼려면 우물안에 시체를 구겨넣고 눈이 꿈적거리는걸 2시간동안 보면된다.
1,참.. 내가 오밤중에 시간투자해서 본게 아까움..그래서??어쩌라고??이말밖에 안나온다 ㅋㅋㅋ
1,이거 왜 봐? ㅋㅋㅋㅋ  이렇게 어이없는 영화 첨봄 .. 두시간 넘게 머했냐.. 나 참 어이없는 귀신영화
1,"좀비씬, 벼락씬 없었으면 3점은 줬을거다. 샤머니즘, 디머널러지, 성경, 부두교, 토속신앙, 전통괴담이 한데 버물려진 짬뽕인데 입안에 넣어보니 모든 재료가 따로 논다."
1,보고나서 기분만 나빠지고 도데체 무슨의도를 전하고자 알수가 없는 개떡같은 영화 임
1,너무 반전에 반전을 가해서 개똥같은 영화가 됨. 그냥 기분만 나쁨
1,쓰레기..무슨 영화를 보는데 종교를 이해하고 찾아야하냐 스토리 연출 막장 감독정신병자같음
1,이런 영화 같지도 않은 쓰래기 는 ocn에서 할 때도 채널 돌려야 되는 거다.
1,기분 되게 나쁜 영화... --
1,영화보는 내내 관도원(남주란다 꼴에) 죽이고 싶다. 초반에 또라기 경찰새퀴(도원)이 딸년이 미친거 처럼 나온다. 마을에 머물고 있는 일본놈 한테 강간당해서 그런거라 생각하고 도원이 새퀴 미친듯이 설친다. 결론은 전부...
2,복선이 아니라 혼선~ 열린 결말이 아니라 뚫린결말~ 감독만의 나홀로 반전 그나마 배우들 연기와 연출력 때 별2개줌! 반전이란 아~ 하며 돌아보면 그동안의 모든 퍼즐이 맞춰지는 것인데 감독이 퍼즐 맞추다 본인도 모르겠...
5,난 이런거 맘에 안든다.
1,"""뭤이 중한디"" 이대사가 궁금해서 보게된 1인 다보고 멍한기분이 가시질 않는다 이건 뭐 그냥C급영화"
5,의문이드는영화 갠적으로재미없는영화예요
1,최근에 본 영화중에 제일 쓰레기 같다.  아덴만 구출작전 보다 못만들었네
1,스토리도 없고 공포도 없고 캐릭터 각자 뭐하는 작자인지도 모르겠고 개 쓰레기영화임 스토리를 관객스스로 알아서 판단하라는 개 쓰레기영화는 이제 그만 나왔으면 한다
1,응 꺼져 친구들 데리고 일본인 잡으러 갈때 연장에 뼈다귀 넣는거 황해 오마쥬 빼고 볼 거 없어
1,보는내내 답답한 영화네요
1,그냥 반전에만 보여주고싶는 개 쓰레기같은 영화임
1,아니 이 영화가 뭐가 재미있다는거야. 정말 짜증나네
1,그래서... 그래서...그래서... 결론이 뭐냐고~!!!
1,이게 15세 관람가라니 말도안된다 영화보고난뒤 이런찝찝한기분은 처음이다 이런 뒤죽박죽영화보고 남긴 철학적해석들이 어이가없다 꿈보다 해몽이라더니
1,좀비나오고나서부터 뭔가 이상했음...내용도 복잡하고 결말도 허무..
1,이건 아니지않나요? ㅠ.ㅠ
1,평점 리뷰 확인 안하고 급하게 시간 제목보고 선택한 내가 바보지..황정민 믿었는데..오랜만에 정말 중간에 나오고 싶었던 돈 아까운 최악의 영화 ㅠ
1,네이버 기자 평론가 또 한 건 했네요.  이런 것을 별  4~5 개 주다니.
1,기분 나쁜영화 결론도 찝찝..  딸아이있는 저로선 지금까지 본 영화중 최악이었어요..
1,몸에 해로워요 좀비물 엑소시스트 싫어하면 보지마여ㅠㅠㅠㅠ제발 왜봤을까..
5,배우들의 연기는  좋으나  내용이 뭔지 모르겠다.   엄마보여드리고 돈만쓰고 욕만듣고....ㅠㅠ
1,엑소시스트에 좀비영화에다 전설의고향 짬뽕한 쓰레기 편집한 영화시간이 아까웠다.
1,잔인하고 폭력적이다.예술이라는 이름으로 커버되기는 그 선을 넘었다
1,졸려죽을뻔 ㅜㅜ 내용도 모르겟구 ㅜㅜ 나만이런건가. . .
1,방금 보고 집에 가는길인데 아 진짜 멘탈 다 빠아지는느낌보는건 자유인데 현기증나고 정신아픔 비추천
1,그냥 웹툰 같음 재미없어요
1,"긴장감, 무서움, 내용 어느 것 하나 만족스러운게 없음 스포도 안 읽었는데 다 눈에 보임... 배우들의 연기만 박수"
1,대한민국 영화감독 지금까지 뭐했노 이기야!곡성같은 영화만들고 나 영화감독이요 나 영화배우요 거들먹거리고 말았다는 얘깁니까!
1,뭐하러 150분??150분 다 쓰면서 이렇게 이유 없는 스토리 전개를 해도 되나?반전에 반전에 반전이 계속 되지만 몰입도는 떨어지고몰입도가 떨어지니 누가 나쁜놈인지 상관없게 된다.힘좀 빼라..있는 척 한다고 반전 많...
2,별로임.. 괜히본듯요
1,진짜 OOOO영화네요 내용도없고 결말도없고 최근 몇년간 본영화중 최악입니다
1,곡소리 나는 영화. 시간 아까워서 ...
4,무슨내용인지 ..??
1,최악의영화한국최악영화
1,쓰레기영화.  보고나서의 찜찜한 기분. .
1,너무 어이없음.  내용도 없고 메세지도 없고...돈 시간 아까워서 짜증나는 영화
4,"공포영화 임이걸 15세로 개봉하다니, 나감독 참 너무하다.앞으로 나홍진은 무조건 생략"
1,"물론 스토리, 작중의 무게감은 탄탄했으나 난 그냥 열린 결말을 너무 너무나도 싫어합니다. 감독은 옛다 먹어라 우리는 그냥 덥석 그리고 서로 그 먹이에 대해 싸우는 것이 난 정말 너무 너무 싫고"
5,평점믿지맙시다 여러분
1,"조용히 보다가 나온 영화... 처음에는 좀 놀라면서 보다가 산중에서 좀비씬... 좀비씬을 왜 그렇게 환한 장소에서, 오랫동안 보여준건가욬ㅋ처음엔 징그러웠는데 나중엔 그냥 웃겼어요"
1,기대하고 보지말아야함좀비나오는거 부터가 너무 몰입도도 떨어지고 별로...
1,아 ㅡㅡ  뭐냐 이거 재밌네
5,일관되지않은 내용인거 같아서
1,영화끝나자 마자 같이 보던 관객들 모두 나와 같은 허무함에 한숨쉬고 뭐야?/ 뭐야? 끝이야? 이러고 나옴.  그냥 하나둘씩 죽어가다가  범인이 누군지 모르게 헷갈리게 하다가 다 OOO 끝남
1,개연성 제로 떡밥영화 ㅎㅎ
1,평론가들다 돈.받아쳐.먹엇나..이게뭔재미라고 개10노잼인데
1,아버지와 딸 의 목청대결
6,다른 건 다 떠나서 좀비는 도대체 왜 나온건데?
1,재미는 있었지만 1점짜리 영화
1,1점도 아까운영화생전처음 평점이라는걸올려보는데반전에 반전이있는데 이렇게 재미없게 만들수가 있는지... 돈내고스트레스받으시려면 보세요
1,지루해여. 음~ 영화는 영화일뿐
2,"어? 이게뭐지?... 솔직히 영화가 끝난후 모든사람의 마음이었을듯.  찝찝하고 뭔지모르겠고..  갠적으로 이런영화는 쓰레기다.  더군다나 억지로 해석하려고 갖다부치고 그러면 뭔가 잘나보이려나?  그냥 앞뒤개연성부족,..."
4,정신건강에 너무해롭습니다. 정말입니다. 정신이 퇴폐?해질수도 있으니 그정도는 아시고 보시는게 좋을듯 합니다.
1,글쎄 이 영화를 보고싶다는 사람에게 추천해주고싶지도않고 괜히 봤다는 생각만 들고 찜찜했다. 정말 두시간 내용전개가 너무 맘에안들고 중점적으로 다루는 내용이 너무 불편해서 내내 스트레스만 받았다
5,별로입니다별로입니다
10,올드보이와 더불어 한국영화 최고의 영화중 하나라 불릴만 하다. 진짜 대박인듯.  조금만 더 이야기 개연성이나 연관성을 명확하게 하면 좋았을 것 같다.(마지막에 정리를 해줬음 좋았을걸)
1,무서워서 잠이안오네요..
1,아니 동대문메가박스에서봤는데 중간에 영사기고장나서끝까지못봤음...하.... 20분남았었는데 이 긴 영화를 다시봐야한다니....
1,돈아깝다.. 도대체 뭘 말할려고 하는건지?  2시간 30분동안 헛짓거리 본듯
1,10점 알바냐ㅠㅠ 관객 우롱하고 피칠갑하는 영화 평점대를 맞추기 위해 1점 줍니다.
1,진짜 별로  인생영화는 무슨 ㅡㅡ
1,이해가  안가네줄거리뭐임
1,15세청소년에게 우째~~ 이런 공포스런영화를  관람허가해준기관이 의심스럽다~~정말로~~머리가 이상하다
1,별점 누가 작업한거 아님? 스토리가 뭐 이래...괜히 봤네...옆사람은 황정민에 대해 알고 봤다는데도 이해 안갔다고 함.
1,"1.5점 영화. 재미.감동.여운 뭐하나 남는게 없다. 이거원 스토리도 병맛이고 배우들 제작비가 아깝다. 돈 받고라도 안볼 영화를 돈주고 영화관에서 보다니,,, 중간에 곡갱이 맞고도 살아나는 클라스... 80년대 영화..."
1,이런영화 심신건강에 너무 안좋네요 영화는 영화일뿐이긴 한데 영화관 나갈뻔한적 손에 꼽는데 진짜 나가자란 말이 절로 나왔어요..찝찝하고 기분 안좋고 날카로워지고 암튼 비추입니다
1,나의 소중한 주말 156분이 날아간느낌처음엔재미없다는 댓글이 알바인줄 알앗는데 세상에 평론가들이 알바생인것인가??
1,주인공은 한명밖에없나?여주인공은 왜안 나와요?
1,스토리 개연성 개노잼 진짜 뭐냐 이딴거
1,와 사이다 결말 바라고 갔다가 고구마 결말 보고 옴
1,최악이다 진짜.... 말하고자 하는게 뭐야??  뭐 어찌자고?
1,진짜 재미없네요 ㅋㅋ3류 영화
1,정말 요란한 영화입니다 건더기없는 조미료 팍팍들어간 무국 먹는 느낌
1,영화는 잘 만들었을 수 있으나 관객 마음을 불쾌하게함 감독 성향 의심간다. 광고쟁이들이 칸빨로 관객을 낚은 희대의 낚시
1,무섭지도 않고 더럽하기만함 좀비나오는장면은 코미딘줄알았음 이런영화확실히정신건강에안좋음
1,"추격자, 황해를 100번 본 매니아로써 이영화는 나홍진 감독의 작품이 아닌것 같습니다. 재미도 감동도 교훈도 스릴도... 없는 좀 실망 스럽네요..."
1,이걸 11000원이나 내고 봤다니;;
1,걍 고급진 쓰레기임 열자
1,쓰레기그냥 영화제를 위해만든기획영화 별 내용이없다
1,양심이 있으면  1점주기도 아깝다. 그냥 좀비스런 괴기영화다
5,무슨일인가했네요 영화가넘어갈수록 황당그자체입니다완전속은기분입니다
5,배우들의 열연이 빛난 나홍진의 졸작...
7,의도된 혼란...정답은 없다...는 거겠지만...조금 지나친 느낌...
2,공짜표로 봐서 그나마 2점...나처럼 낚이는 사람이 많군
6,기대를 안하고 봤는대도 먼가 찝찝한 영화작품성은 좋은대 다소 억지스러움이 있어요
5,제머리로는이해를못햇어여
1,곡성 황정민이 범인이다 ㅅㄱ ㅋㅋㅋ
1,별로... 감독이 전달하려는 메세지가 몬지 모르겠다
5,엑소시스트와 골룸의 적절한 조화 같은 느낌은 멀까감독의 천재성을 이해못한 걸까
1,이게 잼나다고 하는 놈들 뭐하는 놈들이야.. 이딴 스토리구성이면 수십편씩 영화 찍겄다! 스토리가 개연성도 없고 등장 인물들도 이유없이 등장하고 갑자기 좀비는 또 뭔지? 연기 랑 연출은 좋았는데.. 스토리는 발스토리다...
1,왜 19금영화는19금이붙는지알겟다 이건15세가아니다 너무무섭다 진짜정신적으로문제생길거같다 무서우ㅓ서잠도못자겟다
1,엄청난 비극임에도 목적성도 없고관객을 착각하게 만드는데만 ㅋ거기다 좀비?
4,"주변도 호불호 갈리는데 전 개인적으로 불.. 일단 연기를 모두 잘하셔서 볼만은 했는데 , 이 영화가 15세라는 게 믿기지 않네요.   참신한 소재인데  여러가지를 보여주려고 짬뽕을 해둔듯.. 개연성도 문제지만 개인적..."
9,한국 영화의 새로운 시도
10,지옥도를 본듯하다.하지만 계속 생각하게 된다 .정말 이 영화 대박 이라고 밖에 말할수 없다. 스릴과 반전 .오래도록 회자될 최고의 한국 영화
10,관객이 미끼를 물수 밖에 없는 영화
4,이정도가 적정선.아이들의 거친욕설에 이야기는 사기성이 농후한 중구난방.이야기는 벌여놓고 흐지부지한 마무리..이미지 나열로 그럴듯하게 보이지만 가장 과대평가된 작품
2,쓸데없이 겁나 기네 ㅡㅡ
10,왜 7점밖에 안줬는지 모르겠고무서운 거 안 좋아하지만 진짜 잘 만들었다는 생각이 들게 하는 영화.. 알고봐도 놀랍고 모르고보면 더 놀라운 영화
2,감독이 존 ㅡ 나 생각없이 만든거 같다. 아무 단서없이 범인 이놈이다 이러면서 끝남 1점 줄려다가 일본인 연기 불쌍해서 내가 2점준다
4,그냥 보지마세요 정신건강에해로움
9,이런  참을수없는 궁금함.;;;;
6,진짜 짜증나서 0줄라다가 찾아보니 의도는 좋으니 6줌 왜 우리가 돈주고 꾸역꾸역  느려빠진거 참고 감독 장난에 놀아났어야 하죠좀비 패는거는 좀 웃김ㅋㅋ
1,나는무슨장르의영화를보고왔는가
10,영화 줄거리 내내 계속해서 답을 주는데도 이미 미끼를 물어 버린 관객들은 답을 못 찾고 영화가 끝이 날때까지 계속 해서미끼를 물다 끝남. 연기자들도 훌륭하지만 감독이 정말 대단하게 느껴짐 와 진짜 알수록 소름이 돋는...
7,소문보단 덜함인거 같아요
1,난해한건지 난잡한건지
10,보통 남자화장실에 대기줄이 없는데.. 영화가 끝난 뒤 유난히도 줄이 길더군요
10,영화가 끝나도 자꾸 생각하게 하는 영화.사소한 곳에도 내용이 담겨져 있고 포스터를 보고 소름이 끼친 영화.
1,진짜 보는내내 비명이나 우는거밖에 없어서 미치는줄
1,정신적으로 너무 위험한 영화같음..
4,ㅏ무슨내용인지 뭘보라는건지모르겟ㅇ네
7,영화 스토리를 관객이 해석을 해야하는 게 '주'가 되는 영화다. 스토리가 굉장히 어설프고 장면마다 모순이 생기는 구조의 부실성. 긴 상영시간을 잔인함과 고어영상으로 공포감을 주면서 지루함을 날리지만 과...
10,이렇게 오랫동안 긴장해본 영화는 처음이다... 보고난 후 머릿속에 계속 남아서 다시 생각하게 만든다. 다만 쉽게 이해되기만은 어려운 영화
1,안보는게 정신건강에 도움됩니다.
9,오랜만애 영화다운 영화 본거같음 아메리칸 캡틴보다 훨씬 볼만하다 생각한다 평점 같은거 정말 안남기는데 너무 평점이 낮은거 같아서 남긴다 정말 보는 내내 빠져들었었다
3,맵기만 한 짬뽕집. 자극적이면 끝?
1,영화가 끝난후 여운이아니라 찝찝함이 남음.
1,캡틴 아메리카: 시빌 워 두번보세요~
1,첨엔 휴먼 나중엔 좀비물 마지막엔 뭐야
7,왜 청불이아니지????
1,생각보다 너무 잔인했어요 그런거 못보시는 분은 절대 보지 마세요 절대
1,내가 못읽어서 안무서운건가 평이 거품인건가
3,무섭지도 않고 졸리고 지루 개인적으로 진짜 노잼
5,그냥 딱 헐리우드 B급 공포물 수준 공포물에서 흔히 보이는 어거지 플롯도 여지없이 튀어나와 헛 웃움이 아무리 한국 영화라지만 평론가 나부랭이들 반성 좀 해라 니들이 헐리우드 영화에는 엄격한 잣대를 들이대면서 한국영화...
3,몰입이 이상하게 하나도 안되던 영화..감독이 꽹과리를 이리치고 저리치다보니 정신은 없는데남는것도 없었음
1,"불쾌,찝찝,기빨림, 진빠짐, 기분나쁨. 혼란스러움,이해안됨,후회됨,귀신,좀비,무당,종교,악마,어린아이,한숨"
1,모든걸 넘어서는 찝찝함
1,지금보고 나왔는데 알바들 대박...진짜 내용없고 전개도 없는 영화임. 대실망
9,마무리가 안좋앗습니다 나머지내용은반전에반전 굳굳
1,ㅅㅂ정말 욕나오고 기분 나쁨니다.최악의 영화입니다. 더러워요. 내용이 믿도끝도없어요.기분더러워요
1,스트레스 받아서 보다 나옴. 평생 처음임.
1,OOO기영화 ㅋㅋㅋ 도대체 내용이 뭐냐?
1,진짜 뭐라해야되지... 영화끝나고 결말 찝찝해서 핸드폰으로 30분간 결과 해석 찾아보고 있다..이런적 처음임... 반전 많은거는 알겠는데 진짜 빨리감기 해서 보고싶은 부분이 많음... 지루했슴!글고 좀비가 왠 말이냐...
1,노쟘 ㅡㅡ 결말이머이따위? 천우희는 분량이 1%정도네
1,1점  유명감독이 대충 만든  명작명감독 의도  의심하지마라  명작 맞다
1,와... 이게 영화야?? ㅋㅋㅋ
1,장르에 공포 넣어라미스터리 스릴러라해서 범인찾는건줄알고 봤더만그냥 귀신영화네 15세 준 새끼들 반성해라진심 좀비도 역겹고 황당함
1,반전에 목멘 감독의 처절한 몸부림을 보았다.. 돈이 너무 아까워 죽겠다. 리뷰를 쓰려했으나 리뷰 작성이 안된다 평점 낮게 잡아서 그런가? 3시간동안 노력했으나 불발..
5,일단 무서운  장면 없고요  가족끼리 보기 좋은 코미디 영화 입니다. 마지막에 일본 연기자 분이 호빵맨 닮아서 웃겼습니다 ^.^
5,황정민 믿고 보러갔는데 ....걍 할말없음끝나고 관객들 반응이 전부 뭐야? 씨 .. 라고함ㅋㅋㅋ
