review,score
관람객쫄깃하구재밋엇음다~~ ,10
큐브+10억+쏘우+이스케이프 = 이스케이프 룸 ,10
재밌었음 ㅋㅋ 방탈출 좋아하는데 이거보고 나서 한 3달은 못할듯.. ,10
관람객2편 나오겟네..비행기 ,4
관람객굿 이쳔 나와라 또 본다 진짜다 ,10
이 썅 평좀 보러왔다가 스포당해버렸네 스포하는 새기들 남은 올해 가시밭길만 걷기를 ,10
재밌었습니다. 약간의 허술함도 있었지만 킬링타임용으로 굿 ,8
관람객걍 적당히 재밋습니닺ㅋ ,8
보는맛이 쏠쏠하고 재밌었음 현실성 따지는사람은 스토리 짜증날듯ㅋㅋ ,10
오랜만에 재밌게 몰입해서 본영화입니다. 끝에는 다소 아쉽지만 긴장감있게 2시간동안 본거 같음 ,10
중간중간 아 답답하네 싶을 때가 있는데 다보고 나오면 그런거 없음. 정말 잘만들었다. 2도 나온다는데 기대해봅니다. ,9
ㄹㅇ 정신없음 진심  시간 많으면 보세요 ,1
아우 이영허ㅏ 재밌느데요 ㅎㅎㅎ ,10
캡틴마블이랑 이스케이프룸이거 둘다 봤습니다 공통점은 중간에 잠깐 졸았습니다 그리고 다음편 떡밥으로 마무리 ,4
개봉하자마자 봤는데 재밌어요 ㅠㅠ 손에 땀나고 긴장감넘칩니다 진짜 꼭 보세요 ㅠㅠㅠㅠ ,10
관람객개연성이 살짝 아쉽지만.. 2편 때 어떻게 해줄 수 있으려나.. 나름 재밌었긴 한데 고어 잘보는 입장에선 그렇게까지 이펙트 큰 영화는 아니엇던 듯 데이트 코스 잘 때 방탈출 하고 이거 보러가거나 이거 보고 방탈출 하...,8
관람객어제 영화봤는데 저는 재밌게 봤어요 ,10
재밌었고 나름의 반전도 좋았던 영화 ,8
관람객어제 봤는데 음 그냥 쏘쏘했어용 ,8
방탈출 영화.초반에 긴박함을 잘 묘사하는데 마지막이 좀 아쉬웠다 ,7
큐브 시리즈 재밌게 봤는데 비슷해서 꿀잼이었음 ,10
관람객스릴은 있으면서 잔인한 장면은 많이 없어서 더 좋았어요 ,8
관람객그럭저럭 잔인하지도 않고 스릴 잇엇음 ,8
스토리를 좀 더 신경 더 썼으면 해서 아쉽다.. 시간없다면서 갑자기 뜬금없는 자기 인생얘기를 하질 않나 마지막 장면은 배그찍는 줄 알았다..게다가 결말은 뻔한 시리즈1의 결말.. 그래도 몰입감은 최고였다 나름 볼만한...,7
개봉일 심야보고 후기남김..큐브에 4D를 합성한 느낌..시간가는줄 모르고 봤지만 어떻게 큐브를 맞춘건지는 좀 어거지스럽다. ,7
관람객2편 언제나올라낭 ㅎㅎㅎ ,8
관람객킬링타임용중간까진재밌음 ,6
그냥 가볍게 보기에 좋은영화 ㅋㅋ후속편 나오면 보긴 할듯.큐브를 생각하고 보러가면 실망할수 밖에 없음 ,7
프로 방탈출러라면 더욱 좋아할 영화 ! 100분 시간 순삭 ,8
관람객상업 영화치고는 괜찮은 편입니다! 스토리가 현재 유행문화를 언급해서 잘 만들었고 줄거리 발전이 발라서 관객들 심심해하는 틈도 안 줍니다. 즉시 흥분을 충분히 느꼈지만 두번 다시 볼 생각 절대 없고 시퀀스 굳이 기다리...,8
방탈출좋아하는데  영화몰입력있게 잘만들었어요 ,10
스릴넘치고 몰입감은 제대로인 영화! 어지러울정도 ㅋㅋㅋ ,10
관람객방탈출 체험하는기분 다만 쏘우 느낌 생각하고 봐서 그런지 아쉬운점이 좀 있네요  기대를 좀더 낮추고 보면 충분히 재밌게 볼영화 ,8
관람객볼만했습니다 재미있더군요 하하하하 ,10
너무 재밌다.... 쏘우는 징그러운데 이 영화는 세련된듯.... ,10
관람객알던 방탈출보다 스릴있어서 나름 재미있었는데 마지막이 반전이 있을줄 알았는데 없어서 아쉬웠지만 재미있었어요 ^^ ,8
너무 재밌었어요!^^ 꼭 다시 보고싶네용.ㅎㅎ 근데 시즌2도 나오는건가요? 넘나 궁금쓰... ,10
관람객지나치게 자극적이지 않고 무난하게 볼만한 영화임 ,6
방탈줄좋아하는분꼭보세요 ,10
관람객과거에왠지본듯한느낌. ,6
보다보면 엄청 짜임새 있게 만들고 싶어한 흔적들이 많이 보인다. 근데 전형적인 용두사미랄까 근데 많은 허술함을 갖고서도 스릴있고 재밌다. 킬링 타임이라는 목적에서는 정말 쉴틈이 없다. 불필요하게 잔인한 장면들도 없어...,10
방탈출 좋아하는데 손에 땀이 흥건해짐 난 건강이안 좋음 ,10
관람객생각보다 볼만했던!!! ,8
돈 왜 안줌 ??!!ㅠㅠㅠ;;; 아 빡쳐 ,6
관람객아만다 개멋있습니다 영화는 쏘쏘 ,5
관람객잼잇엇습니다. 시간가는줄모르고봣어요 ,9
큐브 비슷하네요  스케일이좀더큼 ,10
취향 잘맞고 가볍게 본다면 추천 ,8
나름볼만함 킬링타임으론좋음 ,8
그럭저럭  볼만함..큐브하고 직쏘가 생각나는 영화!! ,8
신선했구 간간히 심장 쫄리면서 재밌게봤습니당ㅎㅎ킬링타임용으로 굿! ,10
관람객존쟄ㅌㅇ!!!!존재미존재ㅣ존재미 ,10
아직도 심장뜀 최근 영화중 최고였어요 ,10
큐브 + 쏘우 집에서 보삼 ,6
잼있게 잘 봣네용 ㅋ.ㅋ ,8
전 재밌게봤어요가볍게생각하고 본영화인데 몰입도가 좋았어요시간 쑥쑥갑니다 ,10
킬링타임으로 딱재밌늠영화! 솔직히재밌었다ㅋㅋㅋ ,8
진짜 손에 땀 흘렀다.. 보고 나니까 정신병 걸린 느낌.?!아니 약간 폐쇄공포증 비슷..지금 일상생활 불가..미치겠음 결말도 잘 몰겠다 ,6
개꿀잼 왜 외국영화 외국영화 하는지 알겟두라 ,10
쏘우네 살인게임 너무 창의적이다 ㅋㅋㅋㅋ ,10
심오한 뭐 그런건 아니고. 게임이다 ,8
관람객끝부분이 인상적이네요 ,8
밥상을 많이 차려놓은것 같고 음식도 나쁘지 않았는데 금방 잊혀질 것 같다 ,7
초중반 : 긴장감있고 시간가는줄 모름후반 : 맥이 좀 빠짐영화 본 후 : 여운은 없음쓸데없이 잔인하지 않아서 좋았고돈 아깝진 않음 ,8
킬링타임으로 충분히 재밌는 영화 ,8
재밋게 잘봤습니다. 킬링타임용으로 추천합니다 ,10
음 말하는거나 무언가가 어색하다스토리는 재밌다살짝 유치하지만 갠춘개춘 ,5
영화 시간 내내 긴장감이 이어진다 ,10
지루하진않아요 볼만합니나 ,8
쏘우+큐브를 잘 섞어 만든 영화. 재밌었음 ,9
관람객나름 재미 있었어요 ~~~~ ,8
관람객재밋어요방탈출하고싶음 ,8
관람객딱좋다 잔인하지않고 쏘우느낌굿 ,8
예측 가능한 전개이지만 박진감넘쳐요! 킬링타임용 ,8
킬링타임용으로 나름 재밌게 봤네요. 재미없다거나 아주 재밌다거나 하지는 않지만 은근 쫄깃하게 봤어요. 2탄 나올 것 같음.. ,7
오! 대리 체험! 방 탈출! ,7
큐브 재밌게봐서 이것도 기대했는데 센세이션하고 재밌당ㅋㅋ후속도 빨리 보고싶넹 ,9
그래서 결말이 뭐죠?? 돈 있는 권력자는 승리한다? ,6
큐브 완전 재밌게봐서 이것도 보고싶은데 넘 무서울 것 같아우째우째우째~ ,10
재밋음 ㅋㅋ2편기다려짐 ,10
심장쫄깃ㅋㅋ킬링타임용으로잼씀 ,10
스포일러가 포함된 감상평입니다. 감상평 보기와이셔츠 입은 흑인 남자애 개빡친다지가 먼저 해보면 될것이지 ,2
스포일러가 포함된 감상평입니다. 감상평 보기아이스룸에서 빙판 깨져서 대니 빠져 죽었을 때 다른 곳 깨질 가능성 전혀 생각 안한게 코메디 ,2
뻔한 클리셰는 틀린적이 없을까 ,5
개 ㅈ노잼 젓 ㄴ 잼 ㅈ노ㅈㄴ잼 ,1
겨우1만달러에 목숨을 걸어? ,7
"무심코 봤는데 생각보다 손에 땀을 쥐게 할만큼 재미있는 영화였다. 배우들의 연기도 좋았고, 큐브+직쏘를 합쳐놓은 듯 했다. 다만 뭔가 큰 반전은 없다는 게 아쉽고 2편의 내용도 왠지 결말이 예상된다. 그치만 순간순간...",8
적당히 볼만은 한 무난무난한 킬링타임용 영화. 흠이라면 수수께끼를 관객들이 같이 고민하고 풀어가는형식이었으면 좋았을텐데 그럴 여지가 없어서 단순 생존물이 되어버림 ,8
일단 민폐 캐릭터가 한명도 없다는게 제일 좋았음. 특히 아만다 진짜 개멋짐 존재감 오졌다 ,8
재밌어요 꿀잼 2편 나왔으면 좋겠당 ,9
"오랜만에 긴장되고 스릴있는 영화를 본 것 같음., ",10
마약방에 한번 들어가보고싶다 ,8
관람객볼만함 반전은 이미 예쌍했었음 ,9
관람객2탄 기대해봅니다 ㅎㅎㅎㅎ ,9
볼만한 킬링타임영화 큐브 순한맛 ,10
예전 휴대폰으로 했던 탈출게임 검은방같기도 하고 영화 큐브랑 비슷하기도 하네요암튼 이런류 정말 좋아하는데 2탄 기대되네요 ,9
관람객살아야혀  살려고하면 다 산다 ,10
관람객큐브 비슷한 느낑의영화이당 ,8
재밋게 봤어요.. 저는 제이슨하고 아만다가 살아남길 바랬는데 ,8
관람객재미가 있었어요 ㅜㅠㅠ ,10
관람객생각이상 노잼 .-- 너무기대햇나봄.. ,10
"개노잼.. 퍼즐이 뭐 다 개연성 하나없고 어거지로 끼워넣는 수준이고, 장르는 스릴러인데 무슨 긴장감 하나도 없네..  캐릭터 설정도 하나하나 유치하고 이런류의 늘 보던 뻔한 캐릭터 설정임. ",4
관람객기대이상으로 재밋었습니다 ,10
볼만햇지만.. 뭔가 똥쏴다 현관벨 울려서 문열러 가야하는데 휴지가 없어서 똥도 못딱는 상황 같은... 느낌이랄까.... ,6
실제로 저런거 하면 걍 1단계에서 OO머리를 어떻게저렇게 쓰냐 나같음 오줌싸고 OO하다가 바로 오븐규이될듯 제발 머리아프게 좀 살지말자;; ,8
관람객보다가 나왓어여ㅎㅎㅎㅎ ,10
어디선가 본 듯한 장면과 케릭터. 속편 제작을 위한 포석. 허무하게 만드는 결말 ,6
이게 7.5점은 아님. 4~5 정도 ,1
매끈하게 빠진 탈출 스릴러. ,8
킬링타임 영화의 정석. 방탈출 영화 중에 가장 잼나는 듯. 방 하나하나 들어갈 때마다 흥미진진 줄어드는 시간이 아까울 정도. ,8
얼음을 왜 손으로 녹이나? 주변에 나무도 많더만.. ,6
잔인함과 선정적 장면 없이 관객을 압박하는 스릴러 2편이 기대된다 ,9
개연성도 좋고 상당히 재미있게 잘만듬. 진짜 큰 기대 없었는데 생각보다 너무 재미있게 봤던 영화. 이번엔 네티즌 평점이 진짜인듯 ,8
현실감 있는 큐브 느낌나는 영화 ,7
"이런 것은 끝에 이유도 모르고 끝나던데,, 이건 그래도 결말이 있음 ",9
""" 숨셨다 "" 하면서 무기 휘둘루는 장면이 제일 좋았다 ",7
그냥저냥 시간가는줄 모르고 볼만했다. ,8
몰입감 높은 영화에요 잔인하지않아서 어린이도 봐도 될듯. ,10
쏘우 대놓고 따라함 .;; ,1
탈출영화 갠적으로 좋아하는데 자극적인장면은 안나오는데 스릴있고 긴장감있는 영화 ,10
"방탈출 게임에 참여한 6명은 이것이 진짜 살인을위한 게임임을 알게되고, 카메라를 부수고 죽은척한 조이만 게임을 벗어난다. 한편 모든방을 탈출한 벤은 애초에 우승자를 살려둘 생각이없던 그들에게 죽을뻔하나 조이가 구해주...",6
"역시 기대 무지했따 기대하면 실망 무지되는구나,,,-.-;; 끈네 졸다 끝을 봤다,,, ",1
"굉장히 잘만든 수작. 공포를 주려는 흔한 쏘우 형식의 방탈출이 아닌 스릴러,추리형식의 방탈출 ",8
직쏘를 만들고 싶었던 감독. 산으로 가다.... ,4
몰입도 쩌는 영화네요.  간만에  괜찮은 영화 잘봤네요~ ,10
"큐브,직쏘 같은 영화들의 아류... 난 왜 이런 영화들 짜증이 날까. ",2
손으로 얼음 녹이는 건 좀 너무했다. ,8
평식이 방탈출시켜자  ㅎ ,6
깔끔하면서도  스릴  긴장감  넘친다... 흠을  굳이  찾자면... 뭐랄까  영화 쏘우  생각이  자꾸  난다는거 .... ,9
별로 생동감 있지도 않고 스릴도 느껴지지 않고... ,4
신선하고 재밌었다. 2도 흔쾌히 볼듯 ,10
관람객2편 반드시 꼭 봐야겠음 ,10
짧고 간결해서 좋았음 2편도 꼭 봐야지 ,10
관람객별로잼이 없었습니다. ,8
관람객떨려서 너모너모 오줌마렵게함 ,10
관람객초반 긴장감에 합격점을 주고 싶습니다 ,9
딱 킬링타임 영화. 보고 나서 딱히 기억나는 건 없네요 ,5
관람객여러가지 짬뽕이긴해도 재밋게 봣습니다 ,8
관람객재밌었어요 큐브느낌도 살짝나고 ,8
다음편이 기대되는 영화~ 큐브 좋아하신 분들이라면 궈궈!!! ,10
관람객잔인한 장면 없이 스릴넘쳐서 좋았음 ,10
관람객재미있어요 . .재.미있어요 ,10
관람객개잼ㄷ ㄷ ㄷ. ㄷ ㄷ ㄸㄸ ㅏ언 ,10
관람객돈 안아깝습니다 보세요 ,8
관람객재밌었어요 다른 방탈출 영화와 다르게 주인공들 과거 공략해서 방탈출 게임만든거 신박?? ,7
갓.조.이!! 강력한 여성 캐릭터들이 나와요 ,8
아이디어 오진다 진짜 존경스러움 ,10
관람객발끝에서 부터 짜릿한느낌으로  영화감상했네요ㅋㅋ다음편이 계속되나봐요끝이 궁금?해지는 영화인듯요ㅋㅋ여튼 잘봤어요 ,6
진짜 한국영화하고 진짜 차이가 난다. 한국영화도 이런식으로 만들면 대박 날듯 ,10
관람객숨막혀죽을뻔.... 너무한 방탈출 ,6
관람객재미가 정말정말 있습니다 ,10
작성할 댓글도 아까움10자 채우기용 ,2
큐브를 봤는데 이걸 굳이 봐야 하나? ,5
왕꿀잼ㅋ진짜 방탈출 하는 느낌이였음 ,10
관람객재밌다!!!!ㅇㅇㅇ ,10
관람객재미있게뵜어요ㅋㅋ이탄도 기대가 되어요ㅋㅋ ,10
"이정도만 뽑아줘도 잘만든거아닌가. 캐릭터도 잘살렸고 흑형의 셔츠터질듯한 근육, 상의탈의 서비스도 좋았고, 아만다는 진심 무매력의 캡틴마블보다 멋지더만. 빠른속도감에 피튀김도 없고 쫄깃한 상황을 잘 연출했다. 친구한테...",10
관람객생각보다 너무 재밌어요 ,10
영화 완전 재밌네요ㅋㅋ 2편도 기대해보겠음 ,10
스릴감 재밌어요 잔인함 없고 선정성 없고 장르에 최적화 되어 재미있네요 ,10
관람객두번봤어요 두번보니까 더재밌떠영 ,8
보는 내내 긴장감 몰입감 최고임 ,10
관람객재밌다재밌었다재밌군 ,10
개꿀잼ㅇㅇ.. 앞으로의 전개를 암시해주는 복선이 많고 몰입도 개쩔고 보는 와중에 계속 소름끼쳐ㅠ 보고나서 계속 생각남 2편 나오면 볼 의향 완전 있음 ,10
2편 나오면 보고 싶을 정도로영화 괜찮았어요 몰입감도 있고 구성도 괜찮고... ,8
관람객앞부분은 흥미로웠는데 갈수록 뻔함 ,7
시간가는줄몰랏음 존나 흥미진진 ,8
큰 기대는 안했는데 생각보다 긴장감 있고 재밌음. ,7
절묘한 풀이는 없지만각 룸들이 특성이 있어서 좋았음 ,8
관람객가벼운 마음으로 보기딱 좋았어요 엄청 무섭지도 않고 엄청 루즈하지도 않고 계속 탈출을 해야한다는 압박감이 있어서 재밌었어요 2편도 기대되네요 ,8
존잼 손에땀쥐어짐 후아아ㅏ ,10
관람객방탈출좋아해서 재밌었어요 ,10
존잼2탄기대중ㅎㅎㅎ ,10
관람객아이디어도 좋고 연기도 조고 아주 좋아요 ,8
관람객너무 잔인하지 않고 2편이 나오기를 기다리게 만드는 영화 ,10
재미는 있었다만 막 '와~ 쩐다'  수준 까지는 아니구요.인간 심리를 좀 묘사 하려고 한거 같은데 별로..극장에서 보는건 비추천이고IPTV나 집에서 다운받아 보기용으로 딱 좋습니다 ,5
상영시간 적어서 못보겠네 퉤 ,8
난 그냥 그랬다 .... ,6
관람객그냥 딱 킬링타임용인듯 ,6
왜 평이 높지? 내가 이상한가 재미없음. 어디서 본 구성 장면 대사 스토리 . 차라리 큐브를 다시 보세요. ,2
와 개노잽!! 이렇게재미없을수가 ㄷㄷ ,2
긴장감은 잘 조성되어 있었다만 쏘우1과 큐브를 적절히 섞고 기타 클리셰들을 섞어서 참신함이 하나도 없다 솔직히 cgv 미친가격으로 월요일에 11000주고 보기에는 목숨이 위협받지 않는이상 절대 하면 안된다. 걍 나중...,5
"큐브+쏘우= 피빛이 나오지 않는 건전한스릴러,,스토리는 뻔할뻔짜  머리좋은거 말곤 평범한 대학생여자애랑 마트 직원이 거대조직을 소탕하러 간다는속편암시,,큐브시리즈랑 쏘우 안본사람만 보시길공포 스릴러 메니아들눈엔 그냥...",4
관람객2편 빨리 나왔으면 좋겠어요 ,7
"큐브, 쏘우 등 예전에 비슷한 구성의 영화가 많아서인지 신선하지 않습니다. 그냥 방 하나하나의 효과와 구성을 보는정도의 재미입니다. 너무 전형적인 전개.. 스토리의 개연성이나, 맥락의 유연함을 기대한다면 실망할 수 ...",5
"관람객큐브나 쏘우에 미치지는 못하나, 오락영화의 본위에 충실하다. ",7
짜증나 진짜 가족끼리보러가지마세요 싸우는 지름길 ,4
"예상보다 노잼. 비추예요. 이런 영화는 스토리가 쫄깃한게 매럭인데..,아쉽네요 ",4
노잼...정말 허무해요...제이슨 몸만 보다 왔네요.. ,2
별로 . 진심 돈아까움. ,2
ㄹㅇ 알바아니고 영화 오늘 조조로 보고 왔는데 정말 재밌습니다. 평점이 생각보다 낮네요.... ,10
음... 다 모르겠고...어지러워 방이너무러지러워 보고나사 멀미났음 멀미약 챙겨가요.. ,4
나만 긴장 하나도 안됬냐..?? ,4
남주 살아남은 부분까진 좋았는데 그 이후로부터 짱나요 ,5
"기본적인 영웅의 여정을 따라가는 전형적인 스토리에, 그렇다고 방탈출에 참신함도 없어서... 흐음.. ",2
다음편  예고는 뭐지 드라마를 영화로보낸느낌? ,2
개인적으소 별하나도 아까운거같아오.. ,2
더룸. 러스티레이크 같은 게임을 영화화 했을거란 기대..초반 배달된 큐브 두세번 틱틱대더니 초대장..하..그럴거면 그냥 초대장을 보내던지..한정된 상영시간에 여러 스테이지를 등장하니 겉핥기 식으로 통과..볼거리도 없...,5
스릴러광으로써 평점5점만점에2점이요 ,4
야이새퀴들아 영화에는 장단점이 있는거고 이정도면 재밌다하는거다 이눔들아 ,10
관람객진짜 최고엿어요. 쏘우랑 파라노말액티비티 섞어놓은영화같은 ,10
관람객방탈출좋아하는데 2편기대되요 ,8
솔까 난 재미있었다!! ,10
심야 때 남자친구랑 봤어요.평소에 잔인한 영화는 잘 못보는데 억지로 놀래키는 부분도 없고 그렇게 잔인하지 않아서 꽤 볼만 했답니다. 스릴있게 긴장감 느끼고 싶은 분들은 보시길! ,10
생각보다 너무 재밌어서 끝날때까지 몰입해서 보고왔네요!2편나오면 바로보러갈겁니다! ,10
관람객볼만하네요 매니아 층이 많겟어요 ,7
기대안하고 봤는데 진짜 존잼이에욬ㅋㅌㅌㅌ ,10
영화보는 내내 상영시간 생각 안하고 본 건 처음일 정도로 스릴이 엄청 나요!! ,10
꽤 재미있게 봄! 시간 잘 가고 좋았음 ,10
확실한건 캡틴 마블 보단 재밋게 봤다 ,6
덜 잔인한 쏘우랑 레드 주식회사 섞은 느낌 ,10
아만다 불쌍....ㅜ ,8
관람객그럭저럭 재미있게 본듯 ,7
관람객재미있게보았어요. 나름 반전도 있네요 ,8
관람객초반 중반 정말 좋았는데 막판 마지막 부분이 좀 이해가 안가고 아쉽네요 ,8
페르마의 밀실 생각나는건 나뿐인가..! ,8
관람객기대 안했는데 생각보다 몰입도짱 ,10
조이가 너무 좋아서 10 점입니다ㅠㅠ 천재소녀 완전 매력있음 ,10
관람객심장쫄깃쫄깃하이 재밋것으 ,10
재밌다...보는내내 긴장돼서 탈출할때마다 힘빠지는게 문제ㅠㅠ ,10
진짜 너무 꿀잼 ㅠㅠ긴장감 대박이고 결말도 허무하지도 않고 여운이 남는 그런 결말이었어요!! 꼭 보세욤 ,10
신선햇고희생정신 오젓따리 ,8
완전재밌었음 큐브같은영화 좋아하신다면 추천 ! ,10
관람객속편을 봐야겟다는 기대감 ,8
관람객굳이거완개꿀입니니다 ,10
관람객숨쉬는거 까먹을지경 휴.. ,8
관람객아만다..진짜 멋진여자임 젤멋져 ,8
진짜 재밌게봄!! 요즘 나온 거 중에 젤 재밌게 봄 ,10
관람객무슨 1만달러가지고 저렇게 모였나 했더니 100만 달러였구나ㅋㅋ ,6
관람객볼만했어요 ㅎㅎ 킬링타임 굳 ,8
겁나 재밋어요~~ㅋ1ㅋ ,10
진짜 기대안하고 봤는데 방이 여러개라 새롭고 방마다 컨셉이랑 등장인물들과 사물의 상관관계? 같은 것도 새롭고 잔인하지 않고 흥미진진 최-고 ,10
관람객방을 탈출하면 할수록 긴장감 백배 오줌지링뻔.. ,8
큐브랑 비슷하지만 재밌어용 ,9
손에 땀을쥐는 스릴감ㅋㅋㅋ 재밌네요 ,9
스토리 진행 빠르고 지루하지 않음 ,8
관람객별 스토리 없음. 관람 중 몰입도는 최고. ,7
관람객음 잘 봤어요. 쏘쏘~ 기억에 남는 영화는 아니네요~! ,6
관람객그냥저냥 봤네요 만원돈 내고 볼 영화는 아닌듯 ,6
관람객처음에는 볼만한데 점점 막장 ,6
스릴 넘치고 ㅋㅋ 몰입감 최고네요 ,10
영화 호스텔을 방탈출로 바꾼 느낌 이랄까? 나름 재미는 있었음 결말부분은 남는게 없는 느낌이라 아쉬운건 있었음 ,8
뭔가 살짝 뒷부분이 예상가능 ,8
재밌고 긴장되게봤어요 근데 약간 ㅋㅋ 2탄나올듯 ,9
캡틴마블보다 더 잼있어요 ,10
엥 재밌는데 별점테러 오지네 ,10
관람객큐브와 쏘우의 콜라보레이션 쪼금아쉬웠지만 재미있었습니다 ,10
개봉하자 바로봣음신선하고 흥미진진한 영화 ,10
"괜춘함. 끝에가 아쉬웠다는 사람들보고 볼까말까 망설였는데, 그 끝이 영화 러닝타임 10분 정도임. 끝까지 재밌다가 속편 프리퀄 만들것같단 내용으로 끝남. 게임의 동기같은거.. 제일 베스트는 영화구성임. 구성전개가 개...",7
올해 최고의 영화 꽃샘추위인 날에 관람했는데도 긴장감에 손에 땀이 ㅎㄷㄷ 아 그리고 벤 갈땐가더라도 정강이 뼈는 가져가야지!!ㅋㅋ ,10
조조로 봤는데 꿀잼ㅎㅎ 내심장 벌렁거리는소리 내가들어봄ㅋㅋ ,9
관람객다음이야기가 궁금해지네요~~! 몰입도 장난 아닌 영화에요! 꼭 보세요!!!>< ,10
선개봉으로 본 사람들이 혹평하고 있는데 갑자기 평점 쭉 오르고 호평 올라오드라 평점 알바들 잘~ 봤다 큐브에 쏘우 섞고 호스텔 끼얹고 잔인함 다이어트한 영화임 ,5
"연기력 1점, 다시 그 소굴로 기어 처들어가는데 웃으면서 감 + 남주도 쉽게 설득당함 ",3
생각보다 별로...   영화 첫장면보고 조잡함을 직감했는데... 역시나  ㅠ ,1
큐브 짝퉁같은 느낌.. 엉성하기 짝이 없다... 시리즈 계속 나올건가본데... 큐브제로 마냥 마지막에 게임의 의도가 밝혀지고 제작자와 맞딱드릴예정인가? ;;; ,4
타일러 아저씨 맴찣ㅠㅠ ,9
스릴넘침 꿀잼개굿 존잼 ,10
새벽에 이런영화를 보러간 내가밉다 ,1
관람객시간 때우기에 좋았어요 나름대로 스릴도 있었구요! ,10
몰입감 장난아님 추천합니당 ,10
영화관에서 탈출하고 싶었음.. ,2
볼만해여 ㅋㅋ 돈아깝단 생각은 안들었음 ,10
솔직히 캡틴마블보다 재밋음 지루함도 없고 ,8
좆노잼이었음 돈아까움 ,1
각자의 사연이 있다는 건 좋았지만 미숙한 스토리전개와 너무 쉽게 풀어버리는 일반인들 ,6
"이런영화 분명있었어... 지루하지는 않으나..뭔가 잼없음...그냥 그렇고.. 분명 2편 나온다.,... ",5
퍼즐의 흥미도 없을 뿐더러 본인들이 다 잘알아서 풀어줌 방탈출 게임 갔는데 직원이 다풀어주는 느낌이였음 주인공들끼리의 감정 관계선도 너무 억지스럽다고 느껴졌음 주인공들이 빨리 탈출하고 나도 영화관에서 탈출하고 싶었던...,5
결말이 너무 어이없다 결말빼면 진짜 재밌고 흥미진진한데... ,6
관람객2편기대 너무잼있게봤습니다 ,10
퍼즐 같이 풀어가는 재미도 없고 다예상되는 반전없는 스토리에 결말도 어이가없음 억지로 2편 이어 갈려는 느낌 ,1
관람객킬링타임용영화  재미있음 ㅋㅋ ,10
보통 미적지근 그냥그럼 ,6
관람객다소 조잡하고 예측 가능해서 중간에 나가려다가 사연이 궁금해서 다 보았다 ,6
생각없이 봤는데 소름끼칠정도로 흥미진진하고 시간가는줄모름 ,10
예전 큐브라는 영화 시리즈를 좋아했다면 좋아할 영화. 2시간 재밌게 즐겁게 보다 올수 있는 수작. 왠만한 한국영화보단 훨씬 재밌음 ,10
초반의 약간의 지루함 하지만 갈수록 긴장의 끈을 놓을수 없음 ,10
관람객재미었는데 진짜 문제를 휙 휙 넘어가서. ,9
씹노잼잼쥭겠지 ㅠㅜㅠㅜ ,4
시간 가는줄 모르고 봤네요.중간 중간 손에 땀나서 고생하니 티슈 챙기세요 ,9
꽤 신경써 만든 괜찮은 B급 영화 ,7
"장점:1.배우들연기좋음2.쓸모없는 스토리들은 빨리스킵하고 바로 본격장면들어감단점:1.방탈출 트릭은좀 뻔함2.주인공이 너무캐리함3.반전없음4.스토리가 좀 허술함5.생각3분정도하면 바로문제해결다음방도 똑같,그다음방도 똑...",6
